"Event Name","Event Number","Event Type","Host Names","Description","Price","Age Range","Max Tickets","Sold Count","Wait Count","Starts","Start Date (UTC)","Duration (minutes)","More Info","Room","Space","Date Created","Date Updated","View URI"
"Propolis: Learn to Play","279","Board Game","adelinezbrz","Propolis is a worker-placement, engine-building, area-control, and tableau-building game. Players take on the role of medieval bee colonies and take turns deploying bees to collect pollen, fortify their positions, and construct their hives to appease their queen and become the most glorious.","0","Adult (18+)","2","1","0","Friday at 10:00 AM","2026-02-20T15:00:00","60","https://boardgamegeek.com/boardgame/431994/propolis","Decatur/Marietta","Red Meeple 1","2026-02-10T04:44:01","2026-02-10T20:21:31","/conventions/dice-diversions-2026/schedule/279"
"Draw Steel - Road to Broadhurst","172","RPG","Ryan Wicks","Try the new ""tactical, heroic, cinematic fantasy RPG"" in this convention adventure from MCDM. Bring a miniature - this will very much be played on a battle map, folks!
Recommend for experienced tabletop roleplaying players, but I'm more than happy to teach.","0","Teen (13+)","6","4","1","Friday at 10:00 AM","2026-02-20T15:00:00","240","http://","Hall of Heroes","Green Meeple 7","2025-12-23T15:16:15","2026-02-13T04:18:38","/conventions/dice-diversions-2026/schedule/172"
"Learn to Play Space Base","23","Board Game","dianadreeben@att.net","In Space Base, players assume the roles of Commodores of a small fleet of ships. Ships begin docked at their stations and are then deployed to sectors as new ships are commissioned under your command.","0","Teen (13+)","5","5","1","Friday at 10:00 AM","2026-02-20T15:00:00","60","https://boardgamegeek.com/boardgame/242302/space-base","Decatur/Marietta","Red Meeple 4","2025-11-20T03:03:28","2026-01-21T20:08:29","/conventions/dice-diversions-2026/schedule/23"
"Rapscallion","272","RPG","elirainwater","Join a pirate crew of misfits out for danger and wonder on the Great Sea!  Play as a haunted captain possessed by a vengeful ghosts, a bound djinni trapped within a magic book, a dark sea-sorcerer who made a deal with a demon, or a mysterious navigator who stole the heart of the ocean.","0","All Ages","6","2","0","Friday at 10:00 AM","2026-02-20T15:00:00","240","https://magpiegames.com/collections/all/products/standard-bundle-rapscallion","Hall of Heroes","Green Meeple 2","2026-02-02T18:04:39","2026-02-13T20:47:08","/conventions/dice-diversions-2026/schedule/272"
"Fathoms Beyond - a Level 3 Daggerheart One-Shot","277","RPG","Jon Sanderson","A prominent noble from your town named Alfred Izul has not returned from a trade mission to the village of Blackjaw Harbor. Your burgomaster requests you find him and bring him home.

A tale of mystery, cults, and what lies beyond.","0","Teen (13+)","6","2","0","Friday at 10:00 AM","2026-02-20T15:00:00","240","http://","Hall of Heroes","Green Meeple 3","2026-02-09T15:05:45","2026-02-15T14:08:08","/conventions/dice-diversions-2026/schedule/277"
"Terraforming Mars: The Dice Game","141","Board Game","taloon_kp","Terraforming Mars: The Dice Game takes the gameplay from Terraforming Mars and simplifies it while still providing a satisfying number of choices without requiring prior knowledge of all the cards. This event is open to beginners, and will include time for teaching.","0","Teen (13+)","4","4","1","Friday at 10:00 AM","2026-02-20T15:00:00","120","https://boardgamegeek.com/boardgame/296108/terraforming-mars-the-dice-game","Decatur/Marietta","Red Meeple 9","2025-12-21T14:54:31","2026-02-04T01:27:40","/conventions/dice-diversions-2026/schedule/141"
"Learn Twilight Imperium 4th Ed.","78","Board Game","bab5freak","Always wanted to try Twilight Imperium (4th Edition)? Learn the rules, explore factions, and get battle-ready in this fast-paced intro session. No experience needed—just your ambition to conquer the galaxy!","0","Teen (13+)","6","6","1","Friday at 10:00 AM","2026-02-20T15:00:00","180","http://","Decatur/Marietta","Red Meeple 7","2025-11-29T18:41:16","2026-02-11T15:26:37","/conventions/dice-diversions-2026/schedule/78"
"Brass Birmingham: Learn to Play","299","Board Game","Threepw00d","Build networks, grow industries, and navigate the world of the Industrial Revolution. We will begin with rules teach (45 min). Your spot will be held for 10 min past starting time. After that it is 1st come 1st served, or we start with a lower player count out of respect for others' time. ","0","Adult (18+)","3","2","0","Friday at 10:30 AM","2026-02-20T15:30:00","180","https://boardgamegeek.com/boardgame/224517/brass-birmingham","Decatur/Marietta","Red Meeple 8","2026-02-11T03:52:02","2026-02-15T21:29:14","/conventions/dice-diversions-2026/schedule/299"
"Consec-ya!","287","Board Game","mrhenryh","Consec-ya! is the simple card game of “Consec-ya”tive numbers. Roll the die, draw a card, make a trade, and pass the die! Be on the lookout for rotatable and wild cards! Make clever but bold trades! Hurry before the first draw pile runs out! Will having the longest Consec-ya! be enough to win?","0","Preteen (8+)","8","0","0","Friday at 11:00 AM","2026-02-20T16:00:00","60","http://consec-ya.com","Decatur/Marietta","Red Meeple 5","2026-02-10T15:13:21","2026-02-11T03:57:41","/conventions/dice-diversions-2026/schedule/287"
"Propolis: Learn to Play","280","Board Game","adelinezbrz","Propolis is a worker-placement, engine-building, area-control, and tableau-building game. Players take on the role of medieval bee colonies and take turns deploying bees to collect pollen, fortify their positions, and construct their hives to appease their queen and become the most glorious.","0","Adult (18+)","2","2","0","Friday at 11:00 AM","2026-02-20T16:00:00","60","http://","Decatur/Marietta","Red Meeple 1","2026-02-10T04:45:56","2026-02-14T00:34:49","/conventions/dice-diversions-2026/schedule/280"
"Learn to Play Kingsburg","19","Board Game","dianadreeben@att.net","In Kingsburg, players are Lords sent from the King to administer frontier territories.

The game takes place over five years, a total of 20 turns. In every year, there are 3 production seasons for collecting resources, building structures, and training troops","0","Teen (13+)","5","5","0","Friday at 11:00 AM","2026-02-20T16:00:00","90","https://boardgamegeek.com/boardgame/27162/kingsburg","Decatur/Marietta","Red Meeple 4","2025-11-20T03:03:06","2026-01-21T20:08:20","/conventions/dice-diversions-2026/schedule/19"
"D&D 5e Cave River Exploring Level 2","74","RPG","Ian Huffman","Venture into a cavernous megadungeon, Loidheim! A river starts close to the top of the caves, and the Delving Company Boss has provisioned some canoes to chart out the river and go as deep as you can go. System: D&D 2014 rules at level 2. Pregenerated characters will be available, or make your own.","0","Teen (13+)","5","3","0","Friday at 11:00 AM","2026-02-20T16:00:00","240","http://","Hall of Heroes","Green Meeple 5","2025-11-28T18:33:16","2026-02-14T20:12:57","/conventions/dice-diversions-2026/schedule/74"
"Kokopelli: Learn to Play","238","Board Game","Paul Mazzoni","Stefan Feld card game! Players receive a 36-card deck, choosing 10 different ceremonies out of a possible 25, so each game is different. Draw cards, start ceremonies, or play to ceremonies to score points and clear your deck. Pay attention to ceremonies in front of you as they give you abilties!","0","Teen (13+)","4","4","1","Friday at 11:00 AM","2026-02-20T16:00:00","60","https://boardgamegeek.com/boardgame/322195/kokopelli","Decatur/Marietta","Red Meeple 2","2026-01-10T01:14:33","2026-02-04T01:27:20","/conventions/dice-diversions-2026/schedule/238"
"Terraforming Mars for Beginners","12","Board Game","cls.games.atlanta@gmail.com","Full rules explanation followed by guided play. Designed for people who have always wanted to learn Terraforming Mars, but may have found it a little intimidating.","0","Teen (13+)","8","8","1","Friday at 12:00 PM","2026-02-20T17:00:00","180","http://","Decatur/Marietta","Red Meeple 9","2025-11-20T02:54:32","2026-02-14T04:22:25","/conventions/dice-diversions-2026/schedule/12"
"Speed Puzzle - Solo (Sponsored by Cobble Hill Puzzles)","205","Tournaments","ShannonDeWitt","Please read all details carefully before registering.

Date: January 23th
Check-in Time: 11:45 AM
Start Time: 12:00 PM sharp

Puzzle Size: approx. 300 pieces
Image: Revealed when the competition begins!

SOLO MODE ONLY - We are working to add a group puzzle tournament.","0","Teen (13+)","12","5","0","Friday at 12:00 PM","2026-02-20T17:00:00","90","http://","Salon A, B","General Admission","2026-01-06T05:19:20","2026-02-13T12:57:32","/conventions/dice-diversions-2026/schedule/205"
"SFS 2 1-01: Invasion's edge","103","RPG","Josh Caldwell, Liam Fisher","A Starfinder Society Scenario designed for 1st- through 2nd-level characters. A few weeks ago, a massive alien starship emerged from deep space and crashed into the planet Akiton.","0","Teen (13+)","6","5","0","Friday at 12:00 PM","2026-02-20T17:00:00","180","https://store.paizo.com/starfinder-society-scenario-1-01-invasions-edge/","Hall of Heroes","Green Meeple 9","2025-12-08T03:52:40","2026-01-27T20:23:30","/conventions/dice-diversions-2026/schedule/103"
"Gamma World 7E: Cold Snap","116","RPG","RunelordRuss","Roland Winter is being held hostage and you're tasked with getting him back, preferably alive and in one piece. A GAMMA WORLD 7th Edition adventure. Pregenerated characters will be provided.","0","Teen (13+)","6","1","0","Friday at 12:00 PM","2026-02-20T17:00:00","240","https://www.drivethrurpg.com/en/product/161306/d-d-gamma-world-rpg-gw7e","Hall of Heroes","Green Meeple 1","2025-12-10T14:58:19","2026-02-03T14:36:51","/conventions/dice-diversions-2026/schedule/116"
"""Who The Devil Are You?"" a game by Monte Cook","93","RPG","Dspayr","In most RPGs, the GM provides the story, setting, and context to the players and the players create characters to fit that world. But what if we turned all that upside down? In this game, the process of making the characters also builds the world the adventure. Creation takes <30 min.","0","All Ages","8","2","0","Friday at 12:00 PM","2026-02-20T17:00:00","120","https://www.montecookgames.com/who-the-devil-are-you/","Hall of Heroes","Green Meeple 10","2025-12-06T17:05:51","2026-02-11T19:43:16","/conventions/dice-diversions-2026/schedule/93"
"Dice + Diversions Insider Tour","251","Special Event","nocashvalue80@gmail.com","New to Dice + Diversions? First time using Tabletop.Events? Or just want a quick lay of the land and a chance to meet one of the event organizers? We’ve got you covered.","0","All Ages","12","2","0","Friday at 12:00 PM","2026-02-20T17:00:00","30","http://","Hotel Lobby","General Admission","2026-01-14T02:22:14","2026-02-12T19:38:17","/conventions/dice-diversions-2026/schedule/251"
"Vigilante: Mega-City Adventures","71","RPG","Itsgonnarayne, Mickeymicheal42","A super-hero experience utilizing the fast-paced ""One-Punch System"" in a dystopian world where the ""heroes"" have taken over the worlds governments and normal people (Homo Sapiens) are second-class citizens. Which side are you on? New TTRPG - will be teaching system.","0","Teen (13+)","6","0","0","Friday at  1:00 PM","2026-02-20T18:00:00","240","http://","Hall of Heroes","Green Meeple 11","2025-11-26T16:51:35","2026-01-22T14:11:14","/conventions/dice-diversions-2026/schedule/71"
"Cat in the Box","261","Board Game","Greg Forster","Discover this really clever twist on trick-taking! Each card in your hand is a cat in a Schrödinger-type experiment; you know the number from the start, but you determine the color when you play the card (ie, when you “open the box and observe it”). Be careful not to create a paradox!","0","Teen (13+)","3","2","0","Friday at  1:00 PM","2026-02-20T18:00:00","60","https://boardgamegeek.com/boardgame/345972/cat-in-the-box-deluxe-edition","Decatur/Marietta","Red Meeple 1","2026-01-17T02:49:55","2026-02-14T05:30:12","/conventions/dice-diversions-2026/schedule/261"
"Hexes Hold 'Em","216","Playtesting (Unreleased Game)","Duck Lasers","Sling spells, bust your friends, and battle for moon sapphires in this suited, competitive card game for wizards.","0","Teen (13+)","4","2","0","Friday at  1:00 PM","2026-02-20T18:00:00","120","https://www.ducklasers.games/","Grand Ballroom - Hallway","Playtest Pavilion - Blue Meeple 2","2026-01-08T03:44:29","2026-02-09T02:11:13","/conventions/dice-diversions-2026/schedule/216"
"Pirate Borg: Trapped in the Tropics","42","RPG","JonathanL","Ahoy, scallywags! Dive into shark-infested seas & brave a jungle swarming with undead fiends & desperate rogues! In this wild Pirate Borg adventure, danger lurks at every turn. Will ye emerge as legends or join the crew of the damned? Adventure be callin’, so ready yer swords & set sail for glory!","0","Teen (13+)","4","4","0","Friday at  1:00 PM","2026-02-20T18:00:00","240","https://www.limithron.com/pirateborg","Hall of Heroes","Green Meeple 4","2025-11-23T18:44:17","2026-01-21T20:08:14","/conventions/dice-diversions-2026/schedule/42"
"Paint & Take (Miniature Painting)","145","Miniature Painting","russellbeason@gmail.com","Are you new to the world of miniature painting, or are you an expert with a brush? Each attendee will receive a single figure to paint and can try their hand at bringing it to life. Kids under 12 must be accompanied by an adult.","0","All Ages","12","7","0","Friday at  1:00 PM","2026-02-20T18:00:00","90","https://www.warglamour.com/","Albany Room (Miniature Painting)","General Admission","2025-12-22T17:30:28","2026-02-15T02:48:31","/conventions/dice-diversions-2026/schedule/145"
"Learn to Play Sagrada","22","Board Game","dianadreeben@att.net","Draft dice and use the tools-of-the-trade in Sagrada to carefully construct your stained glass window masterpiece.

Each player builds a stained glass window by building up a grid of dice on their player board. Each board has some restrictions on which color or shade (value) of die can be placed","0","Teen (13+)","6","1","0","Friday at  1:30 PM","2026-02-20T18:30:00","90","https://boardgamegeek.com/boardgame/199561/sagrada","Decatur/Marietta","Red Meeple 4","2025-11-20T03:03:24","2026-02-10T05:45:08","/conventions/dice-diversions-2026/schedule/22"
"Kingdomino- for Beginners","24","Board Game","sarrington","Light game- build a kingdom and collect the most points. 
Plays best with 2 or 4 players. 
Will be taught game basics and some strategy.","0","Teen (13+)","4","3","1","Friday at  1:30 PM","2026-02-20T18:30:00","60","http://","Decatur/Marietta","Red Meeple 2","2025-11-20T03:03:51","2026-02-09T03:31:16","/conventions/dice-diversions-2026/schedule/24"
"Eldrich Horror","3","Board Game","Greg Forster","Race around the world facing the macabre, the vicious and the unspeakable in order to stop the Great Old One from awakening! Dive into this classic and widely-beloved co-op game of Lovecraftian horror. Newcomers welcome! We will play the base game, using the Resource and Focus rules.","0","Teen (13+)","3","3","0","Friday at  2:00 PM","2026-02-20T19:00:00","240","https://boardgamegeek.com/boardgame/146021/eldritch-horror","Decatur/Marietta","Red Meeple 1","2025-11-20T02:52:53","2026-01-21T20:06:54","/conventions/dice-diversions-2026/schedule/3"
"D&D 5e - Beginner Friendly - Scarecrow and Mrs. King","38","RPG","DeckofPlayerSafety","Mrs. King's crops just aren't growing like they use to and her fields seem to be infested with.......something.  Can you help exterminate her problems?  New players welcome and pre-gens will be provided.","0","All Ages","6","6","0","Friday at  2:00 PM","2026-02-20T19:00:00","240","http://","Hall of Heroes","Green Meeple 2","2025-11-23T18:34:34","2026-02-13T08:04:17","/conventions/dice-diversions-2026/schedule/38"
"LIFTOFF! 2.0 The Epic Space Race","166","Playtesting (Unreleased Game)","SpaceDude","A gripping, crises resource management technology game/sim on the space race.  Now on preview on Kickstarter.","0","Teen (13+)","4","1","0","Friday at  2:00 PM","2026-02-20T19:00:00","120","http://Liftoff2.com","Grand Ballroom - Hallway","Playtest Pavilion - Blue Meeple 1","2025-12-22T23:50:59","2026-01-28T01:34:08","/conventions/dice-diversions-2026/schedule/166"
"The Monty Python Role Playing Game","278","RPG","elirainwater","A hearty congratulations for having registered to receive instruction in English History via Monty Python’s Cocurricular Mediaeval Reenactment Programme. This Programme is in no way silly or irreverent and can absolutely be taken completely seriously.","0","All Ages","6","2","0","Friday at  2:00 PM","2026-02-20T19:00:00","120","https://www.exaltedfuneral.com/pages/monty-python-role-playing-game","Hall of Heroes","Green Meeple 3","2026-02-09T21:20:30","2026-02-13T12:58:38","/conventions/dice-diversions-2026/schedule/278"
"Galactic Cruise","139","Board Game","taloon_kp","Galactic Cruise is a thinky (but not burnout your brain), worker placement game where players are competing to build and launch cruise ships into space. This event is open to beginners, and will include time for teaching.","0","Teen (13+)","4","4","2","Friday at  2:00 PM","2026-02-20T19:00:00","300","https://boardgamegeek.com/boardgame/391137/galactic-cruise","Decatur/Marietta","Red Meeple 8","2025-12-21T14:49:34","2026-02-04T01:28:00","/conventions/dice-diversions-2026/schedule/139"
"ENTHRONE: Learn to Play","259","Board Game","schevola","ENTHRONE is a unique, abstract deduction strategy game for two players. You are the power behind the power. You are the silent hand and one of these unwitting 8 pawns will be your key to securing complete dominion. But your rival hides their own machinations to challenge you.","0","Preteen (8+)","8","7","0","Friday at  2:00 PM","2026-02-20T19:00:00","30","https://boardgamegeek.com/boardgame/431479/enthrone","Decatur/Marietta","Red Meeple 6","2026-01-16T03:28:48","2026-01-29T20:50:24","/conventions/dice-diversions-2026/schedule/259"
"Learn Twilight Imperium 4th Ed.","81","Board Game","bab5freak","Command the Stars! New to Twilight Imperium 4th Edition? Learn the rules, explore factions, and get battle-ready in this fast-paced intro session. No experience needed—just your ambition to conquer the galaxy!","0","Teen (13+)","6","6","0","Friday at  2:00 PM","2026-02-20T19:00:00","180","http://","Decatur/Marietta","Red Meeple 7","2025-11-30T01:04:58","2026-02-10T20:26:30","/conventions/dice-diversions-2026/schedule/81"
"Brindlewood Bay: Dad Overboard!","85","RPG","efujimoto","Join the Murder Mavens as they investigate a suspicious drowning in cozy Brindlewood Bay. Interview suspects, gather strange clues, and build your own solution in this collaborative, murder-mystery one-shot.","0","Adult (18+)","5","5","0","Friday at  2:00 PM","2026-02-20T19:00:00","240","https://www.gauntlet-rpg.com/brindlewood-bay.html","Hall of Heroes","Green Meeple 10","2025-12-01T15:01:54","2026-02-14T17:31:36","/conventions/dice-diversions-2026/schedule/85"
"The Crypt Has Opened","58","RPG","When Suddenly! Games","In 1993 the world ended not with a bang, but with an exhalation of a Crypt Door. You take on the role of magical practitioners fighting against cryptids and malevolent spirits to reclaim the Dead Spaces of the world. Crowdfunding this February on Kickstarter.","0","Adult (18+)","4","4","0","Friday at  2:00 PM","2026-02-20T19:00:00","240","http://thecrypthasopened.com","Hall of Heroes","Green Meeple 6","2025-11-23T19:29:17","2026-01-21T20:08:54","/conventions/dice-diversions-2026/schedule/58"
"Speed Puzzle - Group (Sponsored by Cobble Hill Puzzles)","221","Tournaments","ShannonDeWitt","This year we add Speed Puzzle - Group Tournament. A max of 4 people per team. A team MUST have at least 2 people. No teammate swaps after puzzle has started.
ONLY one person from team needs to register but everyone is required to have a D+D badge.","0","Teen (13+)","10","5","0","Friday at  2:00 PM","2026-02-20T19:00:00","180","http://","Salon A, B","General Admission","2026-01-08T04:30:28","2026-02-13T14:58:58","/conventions/dice-diversions-2026/schedule/221"
"Wizards everywhere -- high magic D&D","54","RPG","henrycrutcher","DND 5e rules light, where the players play Wizard/Sorcerer hybrids, which not need to prepare spells, and can modify them with meta-magic.  There will be side based initiative, full spell recovery is one hour, 4th level pregen characters provided. It will be combat light, politics heavy.","0","Legal Drinking Age (21+)","5","1","0","Friday at  2:00 PM","2026-02-20T19:00:00","240","http://","Hall of Heroes","Green Meeple 7","2025-11-23T19:16:24","2026-01-21T20:09:20","/conventions/dice-diversions-2026/schedule/54"
"Dice + Diversions Insider Tour","252","Special Event","ShannonDeWitt","New to Dice + Diversions? First time using Tabletop.Events? Or just want a quick lay of the land and a chance to meet one of the event organizers? We’ve got you covered.","0","All Ages","12","5","0","Friday at  2:30 PM","2026-02-20T19:30:00","30","http://","Hotel Lobby","General Admission","2026-01-14T02:25:01","2026-01-30T15:03:46","/conventions/dice-diversions-2026/schedule/252"
"12 Rivers","283","Board Game","The Gaming Lady","Collect magic pearls as they flow downriver in this kinetic worker placement game","0","Preteen (8+)","4","2","0","Friday at  3:00 PM","2026-02-20T20:00:00","60","https://boardgamegeek.com/boardgame/447649/12-rivers","Decatur/Marietta","Red Meeple 5","2026-02-10T15:13:06","2026-02-15T04:22:00","/conventions/dice-diversions-2026/schedule/283"
"D&D 5e24: Defenders of Caer Moray","83","RPG","Komori","The most untamed of the Moonshaes, residents on Moray are accustomed to defending themselves. Recently something has stirred the dark forces that threaten the families of this strategically vital location. Who will answer their call for aid? A 4-hr Adventurers League adventure for Tier 1 (lvl 1-4).","0","Teen (13+)","6","6","0","Friday at  3:00 PM","2026-02-20T20:00:00","240","https://www.adventurersleague.info/","Hall of Heroes","Green Meeple 5","2025-11-30T14:58:27","2026-02-02T18:24:56","/conventions/dice-diversions-2026/schedule/83"
"SETI + Space Agencies: Learn to Play","301","Board Game","Threepw00d","Search for signs of alien life by launching probes and analyzing distant signals. We will begin with rules teach (45 min). Your spot will be held for 10 min past starting time. After that it is 1st come 1st served, or we start with a lower player count out of respect for others' time. ","0","Adult (18+)","3","2","0","Friday at  3:00 PM","2026-02-20T20:00:00","180","https://boardgamegeek.com/boardgameexpansion/445048/seti-space-agencies","Decatur/Marietta","Red Meeple 6","2026-02-11T03:52:12","2026-02-15T21:35:03","/conventions/dice-diversions-2026/schedule/301"
"Knives Out One Shot (5e14/24, 3rd level)","192","RPG","Dallas and Dragons","There’s been a murder, and you and your friends are the most likely suspects. Enter Niles Noir, the professional detective. But when he starts pulling strings that were never meant to be touched, what secrets will come to light?

Come find out in this Knives Out-inspired one-shot.","0","All Ages","6","2","0","Friday at  3:00 PM","2026-02-20T20:00:00","60","http://","Hall of Heroes","Green Meeple 9","2026-01-03T20:02:02","2026-01-28T01:34:19","/conventions/dice-diversions-2026/schedule/192"
"Paint & Take (Miniature Painting)","146","Miniature Painting","russellbeason@gmail.com","Are you new to the world of miniature painting, or are you an expert with a brush? Each attendee will receive a single figure to paint and can try their hand at bringing it to life. Kids under 12 must be accompanied by an adult.","0","All Ages","12","2","0","Friday at  3:00 PM","2026-02-20T20:00:00","90","https://www.warglamour.com/","Albany Room (Miniature Painting)","General Admission","2025-12-22T17:32:07","2026-02-14T20:13:08","/conventions/dice-diversions-2026/schedule/146"
"The Invasion of Kragarog - a Level 3 Daggerheart Oneshot","190","RPG","Bobby Skelton","The time has come to prove yourself to King and Country. Your sovereign - King Hydronthadus VI of Ossuaria - has sent your strike team to instigate the invasion of Kragarog, Ossuaria's sworn enemy. Scout ahead of the main force and spare none in your path. Glory and riches for those who survive!","0","Teen (13+)","8","3","0","Friday at  3:00 PM","2026-02-20T20:00:00","180","http://","Hall of Heroes","Green Meeple 8","2026-01-01T15:07:12","2026-02-02T23:30:14","/conventions/dice-diversions-2026/schedule/190"
"Hexes Hold 'Em","217","Playtesting (Unreleased Game)","Duck Lasers","Sling spells, bust your friends, and battle for moon sapphires in this suited, competitive card game for wizards.","0","Teen (13+)","4","2","0","Friday at  3:00 PM","2026-02-20T20:00:00","120","https://www.ducklasers.games/","Grand Ballroom - Hallway","Playtest Pavilion - Blue Meeple 2","2026-01-08T03:46:58","2026-02-05T16:34:12","/conventions/dice-diversions-2026/schedule/217"
"Hifi: Learn to Play","281","Board Game","adelinezbrz","Produce the B side of an unfinished and legendary rock album.","0","Adult (18+)","3","0","0","Friday at  3:00 PM","2026-02-20T20:00:00","60","https://boardgamegeek.com/boardgame/349575/hifi","Decatur/Marietta","Red Meeple 3","2026-02-10T04:49:00","2026-02-10T15:12:17","/conventions/dice-diversions-2026/schedule/281"
"Netrunner - Learn to Play","202","Board Game","Null Signal Games","Netrunner is a two-player asymmetric card game set in a dystopian cyberpunk future. Check out our booth for products, convention exclusive promos, and merch!

NOTE: This event lists a specific start time, but walkups at all vendor hours are encouraged and welcome!","0","Teen (13+)","8","1","0","Friday at  3:00 PM","2026-02-20T20:00:00","30","https://nullsignal.games/","Grand Ballroom","Orange Meeple 2","2026-01-06T04:33:33","2026-02-05T16:34:36","/conventions/dice-diversions-2026/schedule/202"
