"Event Name","Event Number","Event Type","Host Names","Description","Price","Age Range","Max Tickets","Sold Count","Wait Count","Starts","Start Date (UTC)","Duration (minutes)","More Info","Room","Space","Date Created","Date Updated","View URI"
"The Hollow Cold Facility (A GI JOE RPG story)","49","RPG","Tejay62","Team: you are to deploy to an off‑books Arctic COBRA lab. Intel only shows of a  super‑soldier program; no interior reports. Your orders: infiltrate the lab, recover research drives and lab logs; destroy any remaining samples; neutralize any threats inside. God knows what's waiting for you inside.","0","Teen (13+)","6","2","0","Friday at  8:00 PM","2026-02-21T01:00:00","240","https://renegadegamestudios.com/g-i-joe-roleplaying-game-core-rulebook/","Hall of Heroes","Green Meeple 3","2025-11-23T18:52:58","2026-02-01T01:01:25","/conventions/dice-diversions-2026/schedule/49"
"D&D 5e Random Cave Exploration Level 4","75","RPG","Ian Huffman","Venture into a cavernous megadungeon, Loidheim! Explore a chaotic system of caves that's different every time someone goes in. Take on special exploration roles and seek out The Wandering's secrets. System: D&D 2014 rules at level 4. Pregenerated characters will be available, or make your own.","0","Adult (18+)","5","5","0","Friday at  8:00 PM","2026-02-21T01:00:00","240","http://","Hall of Heroes","Green Meeple 5","2025-11-28T18:33:18","2026-01-21T20:08:56","/conventions/dice-diversions-2026/schedule/75"
"Ultimate Werewolf","199","Social Deduction","","Werewolf is a social deduction game played in rounds with two phases: day and night. By day, players debate who is guilty; by night, special powers are used and the werewolves secretly choose a victim. Will you survive?","0","Teen (13+)","20","1","0","Friday at  8:00 PM","2026-02-21T01:00:00","60","https://boardgamegeek.com/boardgame/152241/ultimate-werewolf","Grand Ballroom - Hallway","Social Deduction Corner","2026-01-06T00:57:51","2026-01-21T20:09:01","/conventions/dice-diversions-2026/schedule/199"
"Pirate Borg: Buried in the Bahamas","95","RPG","idale0001","Ahoy mateys! Welcome to the the Dark Caribbean, a place with great treasures and greater danger. For weeks you've searched for treasure in the Bahamas but now the ship is caught in a hurricane. Plunder if ye dare.

Characters will be rolled at table
All required materials will be provided","0","Teen (13+)","5","4","1","Friday at  8:00 PM","2026-02-21T01:00:00","240","https://www.youtube.com/watch?v=sC6DmNex9l0","Hall of Heroes","Green Meeple 10","2025-12-07T15:11:13","2026-01-22T02:10:44","/conventions/dice-diversions-2026/schedule/95"
"Dread: A Game of Horror and Hope","268","RPG","Jay Randall","Play as regular folks trying to survive in this horror RPG. Instead of rolling dice, you'll need to test your dexterity by pulling Jenga tiles to succeed. If you cause the Jenga tower to fall, your character will meet their unfortunate demise! What horrors await you? Play to find out!","0","Teen (13+)","8","0","0","Friday at  9:00 PM","2026-02-21T02:00:00","240","https://www.greenfieldgames.com/dread-rpg.html","Hall of Heroes","Green Meeple 4","2026-01-20T21:39:00","2026-01-21T20:08:18","/conventions/dice-diversions-2026/schedule/268"
"The Assassination of the Merchant King - Daggerheart Oneshot","189","RPG","Bobby Skelton","The world of Nimia is on the brink of war. The Merchant King of Ossuaria - King Hydronthadus VI - means to upend the peace between the 8 island kingdoms by conquering port towns across the world. Nimia needs heroes. Nimia needs you. Infiltrate the Merchant King's castle and bring him to justice.","0","Adult (18+)","8","0","0","Friday at  9:00 PM","2026-02-21T02:00:00","240","http://","Hall of Heroes","Green Meeple 9","2026-01-01T15:06:56","2026-02-15T04:57:28","/conventions/dice-diversions-2026/schedule/189"
"Middle Ages: Learn to Play","174","Board Game","dianadreeben@att.net","You are the head of a fiefdom and its future is in your hands. Will you develop agriculture with fields and mills? Or will you become a pious church-builder or prefer to feast in your sumptuous palaces? Develop your lands in your image and become the most influential lord in the kingdom.","0","Teen (13+)","5","5","3","Friday at  9:00 PM","2026-02-21T02:00:00","60","https://boardgamegeek.com/boardgame/403754/middle-ages","Decatur/Marietta","Red Meeple 8","2025-12-23T17:05:44","2026-01-21T20:08:43","/conventions/dice-diversions-2026/schedule/174"
"Ultimate Werewolf","200","Social Deduction","","Werewolf is a social deduction game played in rounds with two phases: day and night. By day, players debate who is guilty; by night, special powers are used and the werewolves secretly choose a victim. Will you survive?","0","Teen (13+)","20","4","0","Friday at  9:00 PM","2026-02-21T02:00:00","60","https://boardgamegeek.com/boardgame/152241/ultimate-werewolf","Grand Ballroom - Hallway","Social Deduction Corner","2026-01-06T00:58:32","2026-02-14T06:30:13","/conventions/dice-diversions-2026/schedule/200"
"Slugblaster - TURBO X (New Player Quickstart One Shot)","127","RPG","Rfmccord","You are Teens and you are slugblasters. It's dangerous. It's Stupid. It's got parents in a panic. And it's the coolest thing ever. You'll go on an interdimensional adventure to Be Cool and get In Trouble.","0","Teen (13+)","5","0","0","Friday at 10:00 PM","2026-02-21T03:00:00","240","https://slugblaster.com/","Hall of Heroes","Green Meeple 2","2025-12-14T01:35:43","2026-01-21T20:07:34","/conventions/dice-diversions-2026/schedule/127"
"Hollows - The Sins of Grisham Priory","125","RPG","azzihaq@gmail.com","Hollows is a tactical combat RPG about slaying monsters in cursed dimensions known as Hollows. 

The primary focus of this game is a unique combat system inspired by fighting bosses in video games like Dark Souls.

The game is set in a Victorian Horror setting and may allude to sensitive themes.","0","Adult (18+)","5","4","0","Friday at 10:00 PM","2026-02-21T03:00:00","240","http://","Hall of Heroes","Green Meeple 7","2025-12-13T15:36:10","2026-02-13T20:48:01","/conventions/dice-diversions-2026/schedule/125"
"Blood on the Clocktower","212","Social Deduction","","Blood on the Clocktower	Blood on the Clocktower is a social deduction game of secrets, lies, and logic. Players take on hidden roles as Good or Evil, using unique abilities, discussion, and deception to identify the Demon before time runs out—or ensure it survives.","0","Teen (13+)","12","5","0","Friday at 10:00 PM","2026-02-21T03:00:00","120","https://boardgamegeek.com/boardgame/240980/blood-on-the-clocktower","Albany Room (Social Deductions)","General Seating","2026-01-08T01:58:38","2026-02-14T04:08:47","/conventions/dice-diversions-2026/schedule/212"
"Quacks of Quedlinburg: Learn to Play","173","Board Game","dianadreeben@att.net","In The Quacks of Quedlinburg, players are charlatans — or quack doctors — each making their own secret brew by adding ingredients one at a time. Take care with what you add, though, for a pinch too much of this or that will spoil the whole mixture!","0","Teen (13+)","4","1","0","Friday at 10:00 PM","2026-02-21T03:00:00","90","https://boardgamegeek.com/boardgame/326869/the-quacks-of-quedlinburg-big-box","Decatur/Marietta","Red Meeple 2","2025-12-23T17:05:16","2026-02-09T02:11:35","/conventions/dice-diversions-2026/schedule/173"
"Ultimate Werewolf","201","Social Deduction","","Werewolf is a social deduction game played in rounds with two phases: day and night. By day, players debate who is guilty; by night, special powers are used and the werewolves secretly choose a victim. Will you survive?","0","Teen (13+)","20","0","0","Friday at 10:00 PM","2026-02-21T03:00:00","60","https://boardgamegeek.com/boardgame/152241/ultimate-werewolf","Grand Ballroom - Hallway","Social Deduction Corner","2026-01-06T00:58:59","2026-01-21T20:09:15","/conventions/dice-diversions-2026/schedule/201"
"Everstone: Discovering Ignis","290","Board Game","The Gaming Lady","Restore found relics to working condition as efficiently as possible","0","Teen (13+)","4","0","0","Friday at 11:30 PM","2026-02-21T04:30:00","120","https://boardgamegeek.com/boardgame/392403/everstone-discovering-ignis","Decatur/Marietta","Red Meeple 7","2026-02-10T15:13:35","2026-02-10T15:23:49","/conventions/dice-diversions-2026/schedule/290"
"Saturday Morning Cartoons","196","Special Event","","Start your day with a dose of nostalgia and laughter! Join us for a delightful session featuring all your favorite cartoon pals from the past. Relive the magic, humor, and heartwarming moments that made these classics unforgettable. It’s the perfect way to kick off your day with a smile!","0","All Ages","50","5","0","Saturday at  8:00 AM","2026-02-21T13:00:00","120","http://","Diversions Room - Salon C","Salon C","2026-01-06T00:19:26","2026-02-12T16:43:26","/conventions/dice-diversions-2026/schedule/196"
"Push Push Penguin","178","Eat, Play, Win!","ShannonDeWitt","Penguins are so pushy, especially when scrambling over slippery ice to get to the ocean! In Push Push Penguin, you will compete in a race filled with slides, snacks, and seals.","15","All Ages","50","23","0","Saturday at  8:30 AM","2026-02-21T13:30:00","90","https://diceanddiversions.com/eat-play-win/","Salon A, B","General Admission","2025-12-24T18:55:05","2026-02-14T22:21:21","/conventions/dice-diversions-2026/schedule/178"
"Vast Grimm – The Gallant Obelisk","69","RPG","brian@creaturecuration.com","Explore a derelict starship, scavenge for supplies, all while trying to understand what caused the vessel to crash. Vast Grimm is a rules-light, sci-fi, splatter-punk RPG oozing with body horror and infectious würms. This adventure will be run by one of the game's creators.","0","Teen (13+)","8","7","0","Saturday at  9:00 AM","2026-02-21T14:00:00","240","http://creaturecuration.com/vast-grimm","Hall of Heroes","Green Meeple 4","2025-11-26T16:51:20","2026-02-15T22:37:45","/conventions/dice-diversions-2026/schedule/69"
"Cairn 2e Dungeon Delve","194","RPG","seanthatoneguy","Do you think you have what it takes to take on the treacherous locales of Vald? Will you survive to escape with treasure or glory? Join Sean for a rules-lite, danger-high dungeon delve!

No player pre-game prep needed. Pre-generated characters and supplies will be provided.","0","Adult (18+)","6","4","0","Saturday at  9:00 AM","2026-02-21T14:00:00","240","http://","Hall of Heroes","Green Meeple 5","2026-01-05T23:14:29","2026-02-05T02:22:59","/conventions/dice-diversions-2026/schedule/194"
"The Great Balloon Race","28","Board Game","Eva@interlockingtech.com","The skies are filled with color as the balloons as 8 hot air balloons line up for a thrilling cross country race.  Each player secretly sponsors 3 balloons as you battle others to get your balloons across the finish line first.   1991 - Parker Game - Never released in North America.","0","Preteen (8+)","8","8","1","Saturday at  9:00 AM","2026-02-21T14:00:00","60","https://boardgamegeek.com/boardgame/449/the-great-balloon-race","Decatur/Marietta","Red Meeple 7","2025-11-20T15:12:17","2026-02-02T21:39:29","/conventions/dice-diversions-2026/schedule/28"
"D&D 5e Cave Exploring Level 5","73","RPG","Ian Huffman","Venture into a cavernous megadungeon, Loidheim! A river by a deep cave cult's base was discovered, but no one knows where it came from. Venture upstream and try to chart another way back to the surface. System: D&D 2014 rules at level 5. Pregenerated characters will be available, or make your own.","0","Adult (18+)","5","5","0","Saturday at  9:00 AM","2026-02-21T14:00:00","360","http://","Hall of Heroes","Green Meeple 11","2025-11-28T18:33:13","2026-01-21T20:08:52","/conventions/dice-diversions-2026/schedule/73"
"Into the Dark, a Castles and Crusades adventure","63","RPG","aegrist13 ","An introductory adventure for Castles and Crusades by Troll Lord Games.
A 1st level adventure using Castles and Crusades rules.
Pregenerated characters and dice will be provided.
Family friendly game.","0","Teen (13+)","7","5","0","Saturday at 10:00 AM","2026-02-21T15:00:00","240","http://trolllord.com","Hall of Heroes","Green Meeple 1","2025-11-26T16:50:30","2026-02-14T01:26:55","/conventions/dice-diversions-2026/schedule/63"
"Twilight Imperium + PoK + TE + more","79","Board Game","bab5freak","Play Twilight Imperium 4th Edition and lead your faction to dominance through warfare, politics, and trade. This is an epic, all-day strategy game.
Note: This is a gameplay session only—no rules will be taught. Please attend the intro sessions if you’re new or need a refresher.","0","Teen (13+)","5","3","0","Saturday at 10:00 AM","2026-02-21T15:00:00","600","http://","Decatur/Marietta","Red Meeple 7","2025-11-29T18:42:02","2026-02-10T20:35:21","/conventions/dice-diversions-2026/schedule/79"
"Skyjo","27","Board Game","Eva@interlockingtech.com","Players draw and discard to minimize the total value of their tableau of 12 cards.","0","Preteen (8+)","8","2","0","Saturday at 10:00 AM","2026-02-21T15:00:00","60","https://boardgamegeek.com/boardgame/204135/skyjo","Decatur/Marietta","Red Meeple 5","2025-11-20T15:11:56","2026-02-10T02:56:15","/conventions/dice-diversions-2026/schedule/27"
"D&D 5e - Level 5-7 Character Adventure - Frozen in Time","39","RPG","DeckofPlayerSafety","Icewind Dale is frozen. Those who could fled south. Those who couldn't are stranded, surviving by a thread. Others see this as a stroke of luck for them to strike out into the tundra and stake their claim of rumored treasure, theirs for the taking. Will you survive, or succumb to the very cold grip?","0","All Ages","6","6","0","Saturday at 10:00 AM","2026-02-21T15:00:00","240","http://","Hall of Heroes","Green Meeple 6","2025-11-23T18:36:02","2026-02-09T13:16:06","/conventions/dice-diversions-2026/schedule/39"
"SFS2 1-06: Magic in the Mist","106","RPG","Josh Caldwell, Liam Fisher","A Starfinder Society Scenario designed for 1st- through 2nd-level characters. A mysterious spire shrouded in purple mist has been seen in the jungles of Ukulam, a continent spanning nature preserve on the planet Castrovel. ","0","Teen (13+)","6","4","0","Saturday at 10:00 AM","2026-02-21T15:00:00","180","https://store.paizo.com/starfinder-society-scenario-1-06-magic-in-the-mist/","Hall of Heroes","Green Meeple 9","2025-12-08T03:53:16","2026-01-25T17:29:38","/conventions/dice-diversions-2026/schedule/106"
"Giethoorn","57","Playtesting (Unreleased Game)","adam0084","A village building, tile laying, cozy game about the founding of Giethoorn, a city known as the Venice of the North.","0","Teen (13+)","4","4","0","Saturday at 10:00 AM","2026-02-21T15:00:00","120","http://","Grand Ballroom - Hallway","Playtest Pavilion - Blue Meeple 1","2025-11-23T19:28:48","2026-01-21T20:08:46","/conventions/dice-diversions-2026/schedule/57"
"Arvold Academy: a Daggerheart One-Shot","276","RPG","Jon Sanderson","This one-shot is set in the campaign frame of Five Banners Burning.

Players will all play pre-made characters in their late teens, all at the age of adulthood, who have been invited to a military academy of mysterious and magical origin called, to learn to be leaders of their respective nations.","0","Teen (13+)","6","4","0","Saturday at 10:00 AM","2026-02-21T15:00:00","240","","Hall of Heroes","Green Meeple 7","2026-02-09T15:05:26","2026-02-14T22:16:32","/conventions/dice-diversions-2026/schedule/276"
"Black Forest: Learn to Play","154","Board Game","jcottingham","Manage glass production on your estate in 14th century Black Forest region. Medium weight Euro.","0","Teen (13+)","4","4","1","Saturday at 10:00 AM","2026-02-21T15:00:00","180","https://boardgamegeek.com/boardgame/420805","Decatur/Marietta","Red Meeple 4","2025-12-22T22:51:40","2026-02-15T22:38:52","/conventions/dice-diversions-2026/schedule/154"
"Wyrmspan: Learn to Play","134","Board Game","Aaron Butler","This is great addition to the ""span"" universe. If you like Wingspan, you might even like this more. And, if you've never tried Wingspan or Finspan, this is great way to get introduced to this line of games.","0","Preteen (8+)","4","4","3","Saturday at 10:00 AM","2026-02-21T15:00:00","120","https://boardgamegeek.com/boardgame/410201/wyrmspan","Decatur/Marietta","Red Meeple 1","2025-12-20T20:02:28","2026-01-29T20:52:13","/conventions/dice-diversions-2026/schedule/134"
"Ethnos: Learn to Play","155","Board Game","lowryder007","In Ethnos, players call upon the support of giants, merfolk, halflings, minotaurs, and other fantasy tribes to help them gain control of the land. After three ages of play, whoever has collected the most glory wins!","0","Teen (13+)","5","5","1","Saturday at 10:00 AM","2026-02-21T15:00:00","90","https://boardgamegeek.com/boardgame/206718/ethnos","Decatur/Marietta","Red Meeple 2","2025-12-22T22:52:03","2026-01-21T20:09:12","/conventions/dice-diversions-2026/schedule/155"
"Netrunner - Learn to Play","203","Board Game","Null Signal Games","Netrunner is a two-player asymmetric card game set in a dystopian cyberpunk future. Check out our booth for products, convention exclusive promos, and merch!

NOTE: This event lists a specific start time, but walkups at all vendor hours are encouraged and welcome!","0","Teen (13+)","8","5","0","Saturday at 10:00 AM","2026-02-21T15:00:00","30","https://nullsignal.games/","Grand Ballroom","Orange Meeple 2","2026-01-06T04:33:41","2026-02-05T16:35:17","/conventions/dice-diversions-2026/schedule/203"
"Kaelora - Learn to Play","255","Board Game","Ryan Gutowski","Kaelora is a new game coming from Tangerine Games. Explore a mysterious island, discovering new life and journaling in this puzzley game for 2 to 4 players. This game will be on Kickstarter in March/April 2026.","0","Teen (13+)","3","3","2","Saturday at 10:00 AM","2026-02-21T15:00:00","90","https://boardgamegeek.com/boardgame/456064/kaelora","Decatur/Marietta","Red Meeple 9","2026-01-16T02:34:36","2026-02-12T23:24:53","/conventions/dice-diversions-2026/schedule/255"
"Nahual RPG: A Mexican Urban Fantasy","62","RPG","GeeknRican","You'll shape the story as shape-shifting shamans who scrape together a living hunting Angels and running your Changarro against the odds.

Game Master: Cyrus S.
Setting: Mexico
Rules System: Nahual, PbtA
Number of Players: 3-4
Suitable for Beginners: Yes
Play Style: Emergent Story-driven Gameplay","0","Adult (18+)","4","3","0","Saturday at 10:00 AM","2026-02-21T15:00:00","240","https://nahualrpg.com/","Hall of Heroes","Green Meeple 10","2025-11-26T16:50:10","2026-02-13T04:18:43","/conventions/dice-diversions-2026/schedule/62"
"Zoo Vadis: Learn & Play!","161","Board Game","min27241","In a zoo that's ran by the animals themselves, secure your position at the star exhibit for your chance to become the zoo mascot! There will be crafty politicking, clever negotiations, and ruthless schemes in order to garner laurels and votes from your fellow residents.","0","Adult (18+)","5","5","0","Saturday at 10:30 AM","2026-02-21T15:30:00","120","https://boardgamegeek.com/boardgame/368061/zoo-vadis","Decatur/Marietta","Red Meeple 6","2025-12-22T22:55:35","2026-01-30T02:08:25","/conventions/dice-diversions-2026/schedule/161"
"ENTHRONE: Tournament","258","Tournaments","schevola","ENTHRONE is a unique, abstract deduction strategy game for two players. You are the power behind the power. You are the silent hand and one of these unwitting 8 pawns will be your key to securing complete dominion. But your rival hides their own machinations to challenge you.","0","Teen (13+)","16","0","0","Saturday at 10:30 AM","2026-02-21T15:30:00","120","https://boardgamegeek.com/boardgame/431479/enthrone","Diversions Room - Salon C","Salon C","2026-01-16T03:20:39","2026-01-31T14:32:42","/conventions/dice-diversions-2026/schedule/258"
"Castles of Burgundy - Special Edition","138","Board Game","Mdroms","Classic turn-based strategy game for up to 4 players. Redesign contains 3D settlements, acrylic tiles, player mats, and more.","0","Teen (13+)","4","4","2","Saturday at 11:00 AM","2026-02-21T16:00:00","120","https://boardgamegeek.com/boardgame/363622/the-castles-of-burgundy-special-edition","Decatur/Marietta","Red Meeple 3","2025-12-21T14:48:30","2026-01-21T20:07:15","/conventions/dice-diversions-2026/schedule/138"
"Daybreak","207","Board Game","taloon_kp","Daybreak is a cooperative, engine-building, set collection game where everyone is working together to solve climate change. This event is open to beginners, and will include time for teaching.","0","Teen (13+)","3","2","0","Saturday at 11:00 AM","2026-02-21T16:00:00","180","https://boardgamegeek.com/boardgame/334986/daybreak","Decatur/Marietta","Red Meeple 5","2026-01-07T01:43:26","2026-02-15T21:53:09","/conventions/dice-diversions-2026/schedule/207"
"The Great Dalmuti","29","Board Game","Eva@interlockingtech.com","Get rid of your cards to rise through society from peon to Dalmuti.","0","Preteen (8+)","8","7","0","Saturday at 11:00 AM","2026-02-21T16:00:00","60","https://boardgamegeek.com/boardgame/929/the-great-dalmuti","Decatur/Marietta","Red Meeple 8","2025-11-20T15:12:21","2026-02-09T02:05:03","/conventions/dice-diversions-2026/schedule/29"
"D&D 5e (AL) - WBW-DC-TREY-01, Mistress Taken!","188","RPG","IanBard","The Mistress of Tides has been kidnapped. Her Archfey consort seeks adventurers with a ‘particular set of skills’ to rescue her. Will you answer the call? A 4-Hour Adventurers League Tier 2 adventure. (Please bring a Level 5-10 AL-legal character. A few pre-gens also available.) [Author Run]","0","Teen (13+)","6","3","0","Saturday at 11:00 AM","2026-02-21T16:00:00","240","http://","Hall of Heroes","Green Meeple 8","2025-12-30T22:27:44","2026-02-14T15:37:30","/conventions/dice-diversions-2026/schedule/188"
"Rise of Tribes: Learn to Play","158","Board Game","lowryder007","In ancient prehistoric times, you have discovered a new land with plentiful lakes, mountains and forests (and apparently many stone rocks that shall be called dice). Your people can develop new things like basketry or find oxen or simply GROW and conquer.","0","Teen (13+)","4","3","0","Saturday at 12:00 PM","2026-02-21T17:00:00","90","https://boardgamegeek.com/boardgame/202583/rise-of-tribes","Decatur/Marietta","Red Meeple 1","2025-12-22T22:53:49","2026-02-09T03:31:05","/conventions/dice-diversions-2026/schedule/158"
"Vigilante: Mega-City Adventures","72","RPG","Itsgonnarayne, Mickeymicheal42","A super-hero experience utilizing the fast-paced ""One-Punch System"" in a dystopian world where the ""heroes"" have taken over the worlds governments and normal people (Homo Sapiens) are second-class citizens. Which side are you on? New TTRPG - will be teaching system.","0","Teen (13+)","6","0","0","Saturday at 12:00 PM","2026-02-21T17:00:00","240","http://","Hall of Heroes","Green Meeple 3","2025-11-26T16:51:38","2026-01-21T20:07:27","/conventions/dice-diversions-2026/schedule/72"
"Barista or Bust","247","Playtesting (Unreleased Game)","adam0084","Compete to be the best barista! Place your wager on how many drinks you think you can serve and then work together with the other baristas to try and achieve your goal to gain valuable experience points XP and win.","0","Adult (18+)","5","3","0","Saturday at 12:00 PM","2026-02-21T17:00:00","120","http://","Grand Ballroom - Hallway","Playtest Pavilion - Blue Meeple 1","2026-01-14T01:48:52","2026-01-21T20:07:27","/conventions/dice-diversions-2026/schedule/247"
"Flip 7","206","Board Game","AxolotlWaters","a fast-paced, push-your-luck card game where players draw numbered cards, aiming to collect seven unique ones without drawing a duplicate number.","0","Teen (13+)","8","5","0","Saturday at 12:00 PM","2026-02-21T17:00:00","120","http://https://www.youtube.com/watch?v=7aoCG9gnF8I","Decatur/Marietta","Red Meeple 8","2026-01-06T13:47:19","2026-02-13T14:58:37","/conventions/dice-diversions-2026/schedule/206"
"Paint & Take (Miniature Painting)","147","Miniature Painting","russellbeason@gmail.com","Are you new to the world of miniature painting, or are you an expert with a brush? Each attendee will receive a single figure to paint and can try their hand at bringing it to life. Kids under 12 must be accompanied by an adult.","0","All Ages","12","9","0","Saturday at 12:00 PM","2026-02-21T17:00:00","90","https://www.warglamour.com/","Albany Room (Miniature Painting)","General Admission","2025-12-22T17:32:45","2026-02-12T13:12:48","/conventions/dice-diversions-2026/schedule/147"
"Terraforming Mars for Beginners","11","Board Game","cls.games.atlanta@gmail.com","Full rules explanation followed by guided play. Designed for people who have always wanted to learn Terraforming Mars, but may have found it a little intimidating.","0","Teen (13+)","8","8","1","Saturday at 12:00 PM","2026-02-21T17:00:00","180","http://","Decatur/Marietta","Red Meeple 9","2025-11-20T02:54:28","2026-02-09T03:12:25","/conventions/dice-diversions-2026/schedule/11"
"Pirate Borg: Trapped in the Tropics","43","RPG","JonathanL","Ahoy, scallywags! Dive into shark-infested seas & brave a jungle swarming with undead fiends & desperate rogues! In this wild Pirate Borg adventure, danger lurks at every turn. Will ye emerge as legends or join the crew of the damned? Adventure be callin’, so ready yer swords & set sail for glory!","0","Teen (13+)","4","2","0","Saturday at 12:00 PM","2026-02-21T17:00:00","240","https://www.limithron.com/pirateborg","Hall of Heroes","Green Meeple 2","2025-11-23T18:44:25","2026-01-23T18:58:10","/conventions/dice-diversions-2026/schedule/43"
