"Event Name","Event Number","Event Type","Host Names","Description","Price","Age Range","Max Tickets","Sold Count","Wait Count","Starts","Start Date (UTC)","Duration (minutes)","More Info","Room","Space","Date Created","Date Updated","View URI"
"Western Legends","30","Board Game","Greg Forster","Live the legends! This delightful game with open-ended play options offers the ultimate thematic immersion in the Wild West. Beginners welcome!","0","Teen (13+)","3","3","0","Saturday at  7:00 PM","2026-02-22T00:00:00","180","https://boardgamegeek.com/boardgame/232405/western-legends","Decatur/Marietta","Red Meeple 5","2025-11-20T15:12:42","2026-01-21T20:08:07","/conventions/dice-diversions-2026/schedule/30"
"DC20 Tutorial: Job Hunting","131","RPG","_RM_","This game is intended for first-time or novice DC20 players. I will start the session with an overview of the rules, and then we will dive into the adventure.","0","Teen (13+)","6","3","0","Saturday at  7:00 PM","2026-02-22T00:00:00","120","https://thedungeoncoach.com/pages/dc20","Hall of Heroes","Green Meeple 2","2025-12-15T18:25:15","2026-02-04T01:49:13","/conventions/dice-diversions-2026/schedule/131"
"a Quiet Hunger in Harlem (a Hunter: the Vigil Story)","61","RPG","Tejay62","1935 Harlem: Smalls Paradise thrums with jazz as performers, staff, and patrons revel—until something older and colder tugs at the neighborhood. Whispered bargains, sudden silences, and creeping predation escalate into violence; You, my good hunters, must flee, bargain, or fight to survive.","0","Adult (18+)","5","5","0","Saturday at  7:00 PM","2026-02-22T00:00:00","240","https://www.drivethrurpg.com/en/product/369633/hunter-the-vigil-second-edition","Hall of Heroes","Green Meeple 11","2025-11-24T11:33:41","2026-02-01T01:07:27","/conventions/dice-diversions-2026/schedule/61"
"VNTYPL8S (Sponsored by 25th Century Games)","180","Eat, Play, Win!","ShannonDeWitt","We’re excited to host a VNTYPL8S from 25th Century Games — and you’ll get to play it before it’s released! VNTYPL8S is a fast, funny party game all about clever vanity license plates. You’ll dream up your own plate, show it off, and then watch everyone try to guess who it belongs to.","23","All Ages","50","18","0","Saturday at  7:00 PM","2026-02-22T00:00:00","90","https://diceanddiversions.com/eat-play-win/","Salon A, B","General Admission","2025-12-24T19:00:39","2026-02-15T21:26:30","/conventions/dice-diversions-2026/schedule/180"
"Trailblazer: The John Muir Trail","298","Board Game","The Gaming Lady","Embark on a journey of exploration and discovery along the historic John Muir Trail","0","Teen (13+)","4","0","0","Saturday at  7:30 PM","2026-02-22T00:30:00","180","https://boardgamegeek.com/boardgame/307044/trailblazer-the-john-muir-trail","Decatur/Marietta","Red Meeple 4","2026-02-10T15:14:28","2026-02-10T15:26:45","/conventions/dice-diversions-2026/schedule/298"
"D&D 5e24: Army of the Unseen","82","RPG","Komori","The supply boat from Dynnegall is overdue by almost a tenday. Adventurers venture to the small outpost, only to discover a terrible affliction plaguing the people. Time is running short to save them.  A 4-hr Adventurers League adventure for Tier 1 (lvl 1-4).","0","Teen (13+)","6","4","1","Saturday at  8:00 PM","2026-02-22T01:00:00","240","https://www.adventurersleague.info/","Hall of Heroes","Green Meeple 3","2025-11-30T14:58:24","2026-02-09T17:33:04","/conventions/dice-diversions-2026/schedule/82"
"CBR+PNK - B-WARE THE PRDTR","111","RPG","Nishaant","The perfect distillation of the genre into a bite size package! CBR+PNK is a Forged in the Dark Cyberpunk RPG optimized for electric one-shots and short campaigns. We will be running the PRDTR campaign that comes with the ""Augmented"" edition of the game.","0","Adult (18+)","5","5","3","Saturday at  8:00 PM","2026-02-22T01:00:00","240","https://www.myth.works/products/cbr-pnk?srsltid=AfmBOookBGA453DWE-F36Gy5lV5aMdwBJrOu44NcgxfPF5bhEytTA-a4","Hall of Heroes","Green Meeple 6","2025-12-10T14:54:04","2026-01-21T20:07:05","/conventions/dice-diversions-2026/schedule/111"
"Trouble at the Quorum of Voices - a Daggerheart Oneshot","191","RPG","Bobby Skelton","The Quorum of Voices: an intergovernmental organization where representatives from each of the 8 island nations gather to debate the state of the world. You - along with your fellow security team - receive threats of a magic bomb that's armed to kill everyone present and must find a way to disarm it","0","Adult (18+)","8","0","0","Saturday at  8:00 PM","2026-02-22T01:00:00","240","http://","Hall of Heroes","Green Meeple 8","2026-01-01T15:07:25","2026-02-15T04:56:00","/conventions/dice-diversions-2026/schedule/191"
"Blood on the Clocktower","214","Social Deduction","","Blood on the Clocktower	Blood on the Clocktower is a social deduction game of secrets, lies, and logic. Players take on hidden roles as Good or Evil, using unique abilities, discussion, and deception to identify the Demon before time runs out—or ensure it survives.","0","Teen (13+)","12","10","0","Saturday at  8:00 PM","2026-02-22T01:00:00","120","https://boardgamegeek.com/boardgame/240980/blood-on-the-clocktower","Albany Room (Social Deductions)","General Seating","2026-01-08T02:00:16","2026-02-15T21:44:38","/conventions/dice-diversions-2026/schedule/214"
"Slugblaster - TURBO X (New Player Quickstart One Shot)","128","RPG","Rfmccord","You are Teens and you are slugblasters. It's dangerous. It's Stupid. It's got parents in a panic. And it's the coolest thing ever. You'll go on an interdimensional adventure to Be Cool and get In Trouble.","0","Teen (13+)","5","2","0","Saturday at  9:00 PM","2026-02-22T02:00:00","240","https://slugblaster.com/","Hall of Heroes","Green Meeple 2","2025-12-14T01:35:47","2026-02-13T04:18:21","/conventions/dice-diversions-2026/schedule/128"
"Stand-Up Comedy Live!","169","Special Event","nocashvalue80@gmail.com","Get ready to laugh as a showcase of stand-up comedians tell jokes and provide ""humor for the unconventional."" This 90-minute event is hosted by Mistarii Comedy Group and is restricted to mature audiences only.","0","Adult (18+)","50","38","0","Saturday at  9:00 PM","2026-02-22T02:00:00","90","http://","Diversions Room - Salon C","Salon C","2025-12-23T00:00:03","2026-02-15T21:21:49","/conventions/dice-diversions-2026/schedule/169"
"Dread: A Game of Horror and Hope","269","RPG","Jay Randall","Play as regular folks trying to survive in this horror RPG. Instead of rolling dice, you'll need to test your dexterity by pulling Jenga tiles to succeed. If you cause the Jenga tower to fall, your character will meet their unfortunate demise! What horrors await you? Play to find out!","0","Teen (13+)","8","0","0","Saturday at 10:00 PM","2026-02-22T03:00:00","240","https://www.greenfieldgames.com/dread-rpg.html","Hall of Heroes","Green Meeple 10","2026-01-20T21:43:10","2026-01-21T20:06:54","/conventions/dice-diversions-2026/schedule/269"
"Daggerheart: An Age of Umbra 1st level oneshot","113","RPG","Jared Sheets","The Age of Umbra is a dark and broken age where small villages cling to light admidst a looming darkness. Your village elders speak of a way to reignite your village's dying flame, but will you succumb to the perils in the dark?

Expect vibes of Dark Souls, Elden Ring, or darkstrange fantasy.","0","Teen (13+)","5","4","0","Saturday at 10:00 PM","2026-02-22T03:00:00","240","https://www.daggerheart.com/","Hall of Heroes","Green Meeple 4","2025-12-10T14:54:38","2026-02-06T04:53:13","/conventions/dice-diversions-2026/schedule/113"
"SFS2 1-09: Abduction","109","RPG","Liam Fisher, MelvinBison","A Starfinder Society Scenario designed for 1st- through 2nd-level characters. Agents of the mysterious Functionary, self-proclaimed representative of the Wreck of the Returned, slink through the Sloughscar Hills on the planet Akiton, abducting anyone who refuses to bow to her commands.","0","Teen (13+)","6","1","0","Saturday at 10:00 PM","2026-02-22T03:00:00","180","https://store.paizo.com/starfinder-society-scenario-1-09-abduction/","Hall of Heroes","Green Meeple 9","2025-12-08T03:53:45","2026-02-14T20:13:36","/conventions/dice-diversions-2026/schedule/109"
"Hollows - The Sins of Grisham Priory","126","RPG","azzihaq@gmail.com","Hollows is a tactical combat RPG about slaying monsters in cursed dimensions known as Hollows. 

The primary focus of this game is a unique combat system inspired by fighting bosses in video games like Dark Souls.

The game is set in a Victorian Horror setting and may allude to sensitive themes.","0","Adult (18+)","5","1","0","Saturday at 10:00 PM","2026-02-22T03:00:00","240","http://","Hall of Heroes","Green Meeple 7","2025-12-13T15:36:40","2026-01-21T20:08:33","/conventions/dice-diversions-2026/schedule/126"
"Blood on the Clocktower","215","Social Deduction","","Blood on the Clocktower	Blood on the Clocktower is a social deduction game of secrets, lies, and logic. Players take on hidden roles as Good or Evil, using unique abilities, discussion, and deception to identify the Demon before time runs out—or ensure it survives.","0","Teen (13+)","12","4","0","Saturday at 10:00 PM","2026-02-22T03:00:00","120","https://boardgamegeek.com/boardgame/240980/blood-on-the-clocktower","Albany Room (Social Deductions)","General Seating","2026-01-08T02:01:38","2026-01-21T20:09:31","/conventions/dice-diversions-2026/schedule/215"
"Vantage","297","Board Game","The Gaming Lady","Explore an entire planet's open world from first-person perspectives","0","Teen (13+)","6","5","0","Saturday at 11:30 PM","2026-02-22T04:30:00","180","https://boardgamegeek.com/boardgame/420033/vantage","Decatur/Marietta","Red Meeple 7","2026-02-10T15:14:21","2026-02-14T22:10:50","/conventions/dice-diversions-2026/schedule/297"
"Bomb Busters (3 plus levels)","162","Board Game","AndyA","Cooperative deduction game. Work together to diffuse the bomb but watch out for that bomb!!","0","Teen (13+)","5","5","0","Sunday at  8:00 AM","2026-02-22T13:00:00","90","https://boardgamegeek.com/boardgame/413246/bomb-busters","Decatur/Marietta","Red Meeple 7","2025-12-22T23:03:06","2026-02-13T12:59:29","/conventions/dice-diversions-2026/schedule/162"
"Feast of Legends: The Queen's Quest (Wendy's RPG oneshot)","242","RPG","Kevin Marsh","Come play the Wendy's RPG and join Queen Wendy, first of her name, breaker of fast food chains, defender of all things fresh, never frozen, and defends the realm from the treacherous evils of those who practice the dark art of frozen beef.","0","Preteen (8+)","5","0","0","Sunday at  8:00 AM","2026-02-22T13:00:00","120","http://","Hall of Heroes","Green Meeple 5","2026-01-12T14:28:08","2026-01-21T20:09:23","/conventions/dice-diversions-2026/schedule/242"
"Draw Steel - Road to Broadhurst","171","RPG","Ryan Wicks","Try the new ""tactical, heroic, cinematic fantasy RPG"" in this convention adventure from MCDM. Bring a miniature - this will very much be played on a battle map, folks!
Recommend for experienced tabletop roleplaying players, but I'm more than happy to teach.

Level 1
Pregens provided
No homemade pcs","0","Teen (13+)","6","6","2","Sunday at  9:00 AM","2026-02-22T14:00:00","240","https://www.backerkit.com/c/projects/mcdm-productions/mcdm-rpg","Hall of Heroes","Green Meeple 9","2025-12-23T15:16:11","2026-01-29T03:01:25","/conventions/dice-diversions-2026/schedule/171"
"Dungeon Crawl Classics - Christopher Robin's Nightmare","270","RPG","Lordpyralis115","Christopher Robin's Nightmare is a point-crawl adventure that takes place in the dreams of Christopher Robin. The PCs arrive in the Hundred Acre Wood where they need to save the beloved characters we all know from the classic stories.","0","Teen (13+)","6","0","0","Sunday at  9:00 AM","2026-02-22T14:00:00","240","https://goodman-games.com/dungeon-crawl-classics-rpg/","Hall of Heroes","Green Meeple 1","2026-01-31T18:37:09","2026-01-31T18:40:10","/conventions/dice-diversions-2026/schedule/270"
"Cat in the Box","4","Board Game","Greg Forster","Discover this really clever twist on trick-taking! Each card in your hand is a cat in a Schrödinger-type experiment; you know the number from the start, but you determine the color when you play the card (ie, when you “open the box and observe it”). Be careful not to create a paradox!","0","Teen (13+)","4","0","2","Sunday at 10:00 AM","2026-02-22T15:00:00","60","https://boardgamegeek.com/boardgame/345972/cat-in-the-box-deluxe-edition","Decatur/Marietta","Red Meeple 1","2025-11-20T02:53:00","2026-01-21T20:06:58","/conventions/dice-diversions-2026/schedule/4"
"D&D 5e - Beginner Friendly - Where's Fluffy?","77","RPG","DeckofPlayerSafety","Mrs. Applebottom's tressym (a cat with wings) didn't come home last night and she is terrified for her safety.  Fluffy has been bringing back ""trinkets"" from the cemetery for several days now, but always came home before dark.  Can you find Fluffy and bring her back home?","0","All Ages","6","5","0","Sunday at 10:00 AM","2026-02-22T15:00:00","240","http://","Hall of Heroes","Green Meeple 4","2025-11-29T15:43:48","2026-02-12T13:15:53","/conventions/dice-diversions-2026/schedule/77"
"A Debt Due for a Rougarou (A Daggerheart story)","60","RPG","Tejay62","When a blood debt comes due, the Rougarou stalks the misty bayou. A terrible curse has ravaged Sweet Moss for years. Unravel who bargained, what was promised, and who must pay—before legacy, guilt, and sacrifice drown the local village in shadow. Will you break the curse, or become its next tale.","0","Preteen (8+)","5","3","0","Sunday at 10:00 AM","2026-02-22T15:00:00","240","https://www.daggerheart.com/","Hall of Heroes","Green Meeple 5","2025-11-24T11:32:12","2026-02-12T15:30:14","/conventions/dice-diversions-2026/schedule/60"
"Pam Am: Learn to Play","160","Board Game","AndyA","Build up your airline and sell routes to Pan-Am","0","Teen (13+)","4","3","1","Sunday at 10:00 AM","2026-02-22T15:00:00","120","https://boardgamegeek.com/boardgame/303057/pan-am","Decatur/Marietta","Red Meeple 4","2025-12-22T22:54:59","2026-02-10T20:55:50","/conventions/dice-diversions-2026/schedule/160"
"Barista or Bust","248","Playtesting (Unreleased Game)","adam0084","Compete to be the best barista! Place your wager on how many drinks you think you can serve and then work together with the other baristas to try and achieve your goal to gain valuable experience points XP and win.","0","Adult (18+)","5","0","0","Sunday at 10:00 AM","2026-02-22T15:00:00","120","http://","Grand Ballroom - Hallway","Playtest Pavilion - Blue Meeple 1","2026-01-14T01:50:35","2026-01-21T20:08:15","/conventions/dice-diversions-2026/schedule/248"
"LIFTOFF! 2.0 The Epic Space Race","182","Playtesting (Unreleased Game)","SpaceDude","A gripping, crises resource management technology game/sim on the space race.  Now on preview on Kickstarter.","0","Teen (13+)","4","0","0","Sunday at 10:00 AM","2026-02-22T15:00:00","120","http://Liftoff2.com","Grand Ballroom - Hallway","Playtest Pavilion - Blue Meeple 2","2025-12-27T03:17:30","2026-01-21T20:08:38","/conventions/dice-diversions-2026/schedule/182"
"Alien RPG: Hope's Last Day","117","RPG","GeeknRican","Fight to survive against the odds in this introductory Alien RPG one-shot, and see if you can escape the Hadley's Hope colony alive!

Game Master: Cyrus S.
Setting: Sci-Fi Space Colony
Rules System: Alien 2E, Year Zero
Number of Players: 3-5
Suitable for Beginners: Yes
Themes: Horror, Survival","0","Adult (18+)","5","5","0","Sunday at 10:00 AM","2026-02-22T15:00:00","240","http://","Hall of Heroes","Green Meeple 10","2025-12-11T19:36:12","2026-02-13T13:42:05","/conventions/dice-diversions-2026/schedule/117"
"Estate: Raise the Realm - Learn to Play","236","Board Game","Kathryn Hahn","Learn to play Estate: Raise the Realm with the designers! In Estate: Raise the Realm, players take on the role of noble leaders rebuilding their Estates after the great war, competing to earn the most Victory Points by the fifth Era. Each leader commands unique abilities and an asymmetric tableau.","0","Teen (13+)","5","2","0","Sunday at 10:00 AM","2026-02-22T15:00:00","180","https://www.grodgames.com/estate-raise-the-realm","Decatur/Marietta","Red Meeple 8","2026-01-09T23:41:29","2026-02-09T02:11:02","/conventions/dice-diversions-2026/schedule/236"
"Gay, They, & Gal Paladins (Thirsty Sword Lesbians)","176","RPG","Q","A one-shot for Thirsty Sword Lesbians! Playbooks provided for pre-gens with room to customize. First hour will map relationships and strings, followed by a 3-hour late night romp inspired by equal parts She-Ra, Kipo, Steven Universe, and Owl House.","0","Adult (18+)","6","3","1","Sunday at 10:00 AM","2026-02-22T15:00:00","240","http://","Hall of Heroes","Green Meeple 6","2025-12-24T13:31:19","2026-02-13T14:58:47","/conventions/dice-diversions-2026/schedule/176"
"Netrunner - Learn to Play","204","Board Game","Null Signal Games","Netrunner is a two-player asymmetric card game set in a dystopian cyberpunk future. Check out our booth for products, convention exclusive promos, and merch!

NOTE: This event lists a specific start time, but walkups at all vendor hours are encouraged and welcome!","0","Teen (13+)","8","1","0","Sunday at 10:00 AM","2026-02-22T15:00:00","30","https://nullsignal.games/","Grand Ballroom","Orange Meeple 2","2026-01-06T04:33:48","2026-02-10T20:56:52","/conventions/dice-diversions-2026/schedule/204"
"Flea Market","170","Special Event","radiowing@gmail.com","Embark on a journey with us at our enchanting tabletop flea market, where well-loved board games discover a splendid new haven. Immerse yourself in the joy of finding treasures and, in the process, indulge in delightful savings that will leave you smiling all the way home. This is ATTENDEE TICKETS.","0","All Ages","100","83","0","Sunday at 10:00 AM","2026-02-22T15:00:00","60","http://","Salon A, B","General Admission","2025-12-23T03:46:31","2026-02-14T04:39:16","/conventions/dice-diversions-2026/schedule/170"
"Pirate Borg: The Cavern of Cursed Tears","96","RPG","idale0001","An old sailor, told a tale that caught your attention. Back in his pirate days, a treasure eluded him, the cavern of cursed tears. Spelunk through caverns, mudslides, and spectral sanctums in your search for lost artifacts.

Characters will be rolled at table
All required materials will be provided","0","Teen (13+)","5","3","0","Sunday at 10:00 AM","2026-02-22T15:00:00","240","https://www.youtube.com/watch?v=sC6DmNex9l0","Hall of Heroes","Green Meeple 8","2025-12-07T15:11:15","2026-02-13T22:55:00","/conventions/dice-diversions-2026/schedule/96"
"Snap Ships Tactics: Learn to Play","80","Board Game","Maj.Apollo","Learn to play Snap Ships Tactics, a miniature spacecraft battle game!  This game is easy to learn and quick to play - Can be played 1v1, 2v2, and vs automated opponents.  Several Pre-built ships will be provided as well as parts to customize.  Time should allow for learning and 1-3 games if desired.","0","Teen (13+)","4","3","0","Sunday at 11:00 AM","2026-02-22T16:00:00","120","https://boardgamegeek.com/boardgame/363841/snap-ships-tactics","Decatur/Marietta","Red Meeple 2","2025-11-29T18:42:14","2026-02-10T16:16:12","/conventions/dice-diversions-2026/schedule/80"
"Knarr: Learn to Play","10","Board Game","adelinezbrz","In Knarr, you are the leader of a band of Vikings that you send to new destinations. Manage the recruitment of your crew, and choose the best territories to explore.","0","Adult (18+)","4","4","1","Sunday at 11:00 AM","2026-02-22T16:00:00","60","https://boardgamegeek.com/boardgame/379629/knarr","Decatur/Marietta","Red Meeple 1","2025-11-20T02:54:11","2026-02-04T01:53:04","/conventions/dice-diversions-2026/schedule/10"
"Koopia","230","Playtesting (Unreleased Game)","Keith_Koopia","Koopia is a handcrafted wooden dexterity game designed for quick play and lasting fun. Players flick discs into scoring pits using skill and control, making every round exciting and accessible for all ages and skill levels.","0","All Ages","4","3","0","Sunday at 11:00 AM","2026-02-22T16:00:00","60","http://","Grand Ballroom - Hallway","Playtest Pavilion - Blue Meeple 3","2026-01-09T01:41:38","2026-01-21T20:08:02","/conventions/dice-diversions-2026/schedule/230"
"Settlers of Catan","240","Board Game","LDegoursac","Game of strategy, intuition, and luck. The original game, no expansions.","0","Teen (13+)","3","2","0","Sunday at 11:00 AM","2026-02-22T16:00:00","90","http://","Decatur/Marietta","Red Meeple 7","2026-01-12T04:15:38","2026-02-15T15:26:43","/conventions/dice-diversions-2026/schedule/240"
"Learn to Play KeyForge! (Free deck included)","304","Board Game","erikwaters","Tired of the hustle and bustle of having to build decks to play your TCG games? Come learn to play KeyForge, the innovative card game where every deck you play is a completely unique combination of cards! No other player will ever wield the same KeyForge deck as you! Free deck included!","0","All Ages","8","0","0","Sunday at 11:00 AM","2026-02-22T16:00:00","90","http://keyforging.com","Decatur/Marietta","Red Meeple 5","2026-02-13T15:12:37","2026-02-13T15:13:34","/conventions/dice-diversions-2026/schedule/304"
"Faraway (2023): Learn to Play","136","Board Game","Aaron Butler","Faraway is a card game that uses a combination of drafting and set collection. It seems simple on the surface, but can be delightfully challenging. Always a hit!","0","Teen (13+)","6","6","0","Sunday at 11:00 AM","2026-02-22T16:00:00","60","https://boardgamegeek.com/boardgame/385761/faraway","Decatur/Marietta","Red Meeple 6","2025-12-20T21:47:28","2026-01-21T20:08:28","/conventions/dice-diversions-2026/schedule/136"
"Genesys Zombie Survival Looter","76","RPG","Ian Huffman","You are part of a small community built up in the aftermath of a zombie apocalypse (think The Walking Dead). Go out on a looting run, then pick how the loot is used!
Experience with Genesys not required- it's relatively easy to learn game. Pregenerated characters will be available, or make your own.","0","Teen (13+)","6","6","0","Sunday at 11:00 AM","2026-02-22T16:00:00","240","http://","Hall of Heroes","Green Meeple 7","2025-11-28T18:33:20","2026-02-13T08:12:43","/conventions/dice-diversions-2026/schedule/76"
"Gloomies","292","Board Game","The Gaming Lady","As a galactic gardener, grow & harvest during the two stellar phases of splendor","0","Preteen (8+)","4","0","0","Sunday at 12:00 PM","2026-02-22T17:00:00","60","https://boardgamegeek.com/boardgame/433386/gloomies","Decatur/Marietta","Red Meeple 9","2026-02-10T15:13:44","2026-02-10T15:27:12","/conventions/dice-diversions-2026/schedule/292"
"Vanguard, The Age of Heroes","68","RPG","Itsgonnarayne, Mickeymicheal42","A super-hero event of self-discovery and super heroics in the throes of a planetary invasion from space, other realities, alternate dimensions, and hidden empires. New TTRPG - will be teaching system.","0","Adult (18+)","6","2","0","Sunday at 12:00 PM","2026-02-22T17:00:00","240","http://","Hall of Heroes","Green Meeple 11","2025-11-26T16:51:15","2026-02-14T20:13:42","/conventions/dice-diversions-2026/schedule/68"
"LIFTOFF! 2.0 The Epic Space Race","183","Playtesting (Unreleased Game)","SpaceDude","A gripping, crises resource management technology game/sim on the space race.  Now on preview on Kickstarter.","0","Teen (13+)","4","1","0","Sunday at 12:00 PM","2026-02-22T17:00:00","120","http://Liftoff2.com","Grand Ballroom - Hallway","Playtest Pavilion - Blue Meeple 2","2025-12-27T03:29:19","2026-01-28T01:32:59","/conventions/dice-diversions-2026/schedule/183"
"Mothership - A COG in the Machine","267","RPG","PaleoGamer","A group of new indentures assigned to the COG are fresh out of training and on the COG Cruiser ""Constant Sorrow."" They have been awakened from hypersleep to investigate the Ice Miner ""van Rijn,"" which is broadcasting a distress signal.

What will they find? And, can they survive their first mission?","0","Teen (13+)","6","0","0","Sunday at 12:00 PM","2026-02-22T17:00:00","240","http://","Hall of Heroes","Green Meeple 2","2026-01-20T20:55:48","2026-01-21T20:08:11","/conventions/dice-diversions-2026/schedule/267"
"Learn to Play Nova Luna","20","Board Game","dianadreeben@att.net","The new moon is a symbol for a new beginning, the perfect time to start something new and to plan your future — and that is what Nova Luna (lat. for new moon) is all about. In each round of this abstract tile-laying game, you have to plan your future anew, developing a new strategy to cope with what","0","Teen (13+)","4","4","0","Sunday at 12:00 PM","2026-02-22T17:00:00","60","https://boardgamegeek.com/boardgame/284435/nova-luna","Decatur/Marietta","Red Meeple 3","2025-11-20T03:03:11","2026-01-28T01:32:40","/conventions/dice-diversions-2026/schedule/20"
"Koopia","231","Playtesting (Unreleased Game)","Keith_Koopia","Koopia is a handcrafted wooden dexterity game designed for quick play and lasting fun. Players flick discs into scoring pits using skill and control, making every round exciting and accessible for all ages and skill levels.","0","All Ages","4","0","0","Sunday at 12:00 PM","2026-02-22T17:00:00","60","http://","Grand Ballroom - Hallway","Playtest Pavilion - Blue Meeple 3","2026-01-09T01:42:45","2026-01-28T02:24:20","/conventions/dice-diversions-2026/schedule/231"
"Paint & Take (Miniature Painting)","150","Miniature Painting","russellbeason@gmail.com","Are you new to the world of miniature painting, or are you an expert with a brush? Each attendee will receive a single figure to paint and can try their hand at bringing it to life. Kids under 12 must be accompanied by an adult.","0","All Ages","12","1","0","Sunday at 12:00 PM","2026-02-22T17:00:00","90","https://www.warglamour.com/","Albany Room (Miniature Painting)","General Admission","2025-12-22T17:34:43","2026-02-09T03:30:01","/conventions/dice-diversions-2026/schedule/150"
