"Event Name","Event Number","Event Type","Host Names","Description","Price","Age Range","Max Tickets","Sold Count","Wait Count","Starts","Start Date (UTC)","Duration (minutes)","More Info","Room","Space","Date Created","Date Updated","View URI"
"Koopia","222","Playtesting (Unreleased Game)","Keith_Koopia","Koopia is a handcrafted wooden dexterity game designed for quick play and lasting fun. Players flick discs into scoring pits using skill and control, making every round exciting and accessible for all ages and skill levels.","0","All Ages","4","2","0","Friday at  3:00 PM","2026-02-20T20:00:00","60","http://","Grand Ballroom - Hallway","Playtest Pavilion - Blue Meeple 3","2026-01-09T01:31:21","2026-02-12T16:32:08","/conventions/dice-diversions-2026/schedule/222"
"Terraforming Mars for Beginners","1","Board Game","cls.games.atlanta@gmail.com","Full rules explanation followed by guided play. Designed for people who have always wanted to learn Terraforming Mars, but may have found it a little intimidating.","0","Teen (13+)","8","2","0","Friday at  3:30 PM","2026-02-20T20:30:00","180","https://boardgamegeek.com/boardgame/167791/terraforming-mars","Decatur/Marietta","Red Meeple 9","2025-11-08T19:07:30","2026-01-21T20:07:26","/conventions/dice-diversions-2026/schedule/1"
"Learn to Play Castle Combo","17","Board Game","dianadreeben@att.net","Castle Combo is a tableau-building game that combines simplicity with deep, engaging gameplay, offering highly satisfying experiences.

Each player will spend coins to draft 9 cards from 2 open markets on the table (the lower and upper city), creating along the game a 3x3 square of people interactin","0","Teen (13+)","5","4","0","Friday at  3:30 PM","2026-02-20T20:30:00","60","https://boardgamegeek.com/boardgame/416851/castle-combo","Decatur/Marietta","Red Meeple 4","2025-11-20T03:02:35","2026-01-22T19:22:10","/conventions/dice-diversions-2026/schedule/17"
"Clank- for Beginners","2","Board Game","sarrington","Build your deck and hurry into the dragons lair to steal the treasures. Just be sure to get above ground (or better yet , out of the castle) before the dragon catches up!","0","Teen (13+)","4","4","0","Friday at  3:30 PM","2026-02-20T20:30:00","120","http://","Decatur/Marietta","Red Meeple 2","2025-11-20T02:52:31","2026-01-21T20:09:29","/conventions/dice-diversions-2026/schedule/2"
"Daggerheart: A Beast Feast 1st level oneshot","112","RPG","Jared Sheets","The village of Elmore has been safe from dangerous monsters for decades. Now, that safety net is failing. It's up to a plucky band of newcomer adventurers to keep Elmore safe from a mysterious, hungry beast!

Expect vibes similar to Monster Hunter, Delicious in Dungeon, and light-hearted fantasy.","0","Teen (13+)","6","5","0","Friday at  4:00 PM","2026-02-20T21:00:00","240","https://www.daggerheart.com/","Hall of Heroes","Green Meeple 3","2025-12-10T14:54:27","2026-02-14T01:29:49","/conventions/dice-diversions-2026/schedule/112"
"Koopia","223","Playtesting (Unreleased Game)","Keith_Koopia","Koopia is a handcrafted wooden dexterity game designed for quick play and lasting fun. Players flick discs into scoring pits using skill and control, making every round exciting and accessible for all ages and skill levels.","0","All Ages","4","0","0","Friday at  4:00 PM","2026-02-20T21:00:00","60","http://","Grand Ballroom - Hallway","Playtest Pavilion - Blue Meeple 3","2026-01-09T01:33:33","2026-01-21T20:07:35","/conventions/dice-diversions-2026/schedule/223"
"SFS2 1-03: Disaster at Dreamlink Labs","104","RPG","Josh Caldwell, Liam Fisher","A Starfinder Society Scenario designed for 1st- through 2nd-level characters. When a nascent godling called the Newborn was birthed from the planet Aucturn in 324 AG, chunks of its planetary womb and embryonic fluids were cast across the Pact Worlds.","0","Teen (13+)","6","2","0","Friday at  4:00 PM","2026-02-20T21:00:00","180","https://store.paizo.com/starfinder-society-scenario-1-03-disaster-at-dreamlink-labs/","Hall of Heroes","Green Meeple 9","2025-12-08T03:52:49","2026-01-21T20:08:09","/conventions/dice-diversions-2026/schedule/104"
"LIFTOFF! 2.0 The Epic Space Race","168","Playtesting (Unreleased Game)","SpaceDude","A gripping, crises resource management technology game/sim on the space race.  Now on preview on Kickstarter.","0","Teen (13+)","4","3","0","Friday at  4:00 PM","2026-02-20T21:00:00","120","http://Liftoff2.com","Grand Ballroom - Hallway","Playtest Pavilion - Blue Meeple 1","2025-12-22T23:53:31","2026-01-31T14:32:28","/conventions/dice-diversions-2026/schedule/168"
"Gamma World 7E: Cold Snap","115","RPG","RunelordRuss","Roland Winter is being held hostage and you're tasked with getting him back, preferably alive and in one piece. A GAMMA WORLD 7th Edition adventure. Pregenerated characters will be provided.","0","Teen (13+)","6","2","0","Friday at  4:00 PM","2026-02-20T21:00:00","240","https://www.drivethrurpg.com/en/product/161306/d-d-gamma-world-rpg-gw7e","Hall of Heroes","Green Meeple 1","2025-12-10T14:58:07","2026-01-23T18:58:06","/conventions/dice-diversions-2026/schedule/115"
"Hifi - Learn to Play","282","Board Game","adelinezbrz","Produce the B side of an unfinished and legendary rock album.","0","Adult (18+)","3","0","0","Friday at  4:00 PM","2026-02-20T21:00:00","60","https://boardgamegeek.com/boardgame/349575/hifi","Decatur/Marietta","Red Meeple 3","2026-02-10T04:49:19","2026-02-10T15:12:34","/conventions/dice-diversions-2026/schedule/282"
"Bear Mountain Camping Adventure","286","Board Game","The Gaming Lady","Explorers race to be the first to reach the coveted Bear Mountain Campsite","0","Preteen (8+)","4","0","0","Friday at  5:00 PM","2026-02-20T22:00:00","120","https://boardgamegeek.com/boardgame/394201/bear-mountain-camping-adventure","Decatur/Marietta","Red Meeple 5","2026-02-10T15:13:18","2026-02-10T15:22:49","/conventions/dice-diversions-2026/schedule/286"
"Estate: Raise the Realm - Learn to Play","235","Board Game","Kathryn Hahn","Learn to play Estate: Raise the Realm with the designers! In Estate: Raise the Realm, players take on the role of noble leaders rebuilding their Estates after the great war, competing to earn the most Victory Points by the fifth Era. Each leader commands unique abilities and an asymmetric tableau.","0","Teen (13+)","5","0","0","Friday at  5:00 PM","2026-02-20T22:00:00","180","https://www.grodgames.com/estate-raise-the-realm","Decatur/Marietta","Red Meeple 7","2026-01-09T17:39:42","2026-01-21T20:07:28","/conventions/dice-diversions-2026/schedule/235"
"Paint & Take (Miniature Painting)","148","Miniature Painting","russellbeason@gmail.com","Are you new to the world of miniature painting, or are you an expert with a brush? Each attendee will receive a single figure to paint and can try their hand at bringing it to life. Kids under 12 must be accompanied by an adult.","0","All Ages","12","4","0","Friday at  5:00 PM","2026-02-20T22:00:00","90","https://www.warglamour.com/","Albany Room (Miniature Painting)","General Admission","2025-12-22T17:32:53","2026-02-09T03:29:38","/conventions/dice-diversions-2026/schedule/148"
"Koopia","224","Playtesting (Unreleased Game)","Keith_Koopia","Koopia is a handcrafted wooden dexterity game designed for quick play and lasting fun. Players flick discs into scoring pits using skill and control, making every round exciting and accessible for all ages and skill levels.","0","All Ages","4","0","0","Friday at  5:00 PM","2026-02-20T22:00:00","60","http://","Grand Ballroom - Hallway","Playtest Pavilion - Blue Meeple 3","2026-01-09T01:34:05","2026-01-21T20:07:52","/conventions/dice-diversions-2026/schedule/224"
"Learn to Play Code 777","18","Board Game","dianadreeben@att.net","The clever little game Code 777 combines the elements of a good, logical deduction game and Indian poker. Each player receives a rack for keeping three tiles drawn from a pool of tiles, which are seven different numbers in seven different colors (28 tiles in total); however, the rack is turned away","0","Teen (13+)","5","3","0","Friday at  5:00 PM","2026-02-20T22:00:00","90","https://boardgamegeek.com/boardgame/443/code-777","Decatur/Marietta","Red Meeple 4","2025-11-20T03:03:00","2026-02-09T03:14:43","/conventions/dice-diversions-2026/schedule/18"
"Blightfall TTRPG","32","RPG","mpayers","Blightfall is a dark fantasy TTRPG geared for tragic tales of mutated villagers trading their humanity for the power to defend their home.

Read a playtest review here: https://secretsundaysampler.com/2025/10/16/blightfall-doomed-heroes/","0","Teen (13+)","5","4","0","Friday at  5:00 PM","2026-02-20T22:00:00","240","https://www.backerkit.com/call_to_action/3ffbc037-ccef-4a3f-90f2-a1772152b00a/landing","Hall of Heroes","Green Meeple 4","2025-11-22T14:17:09","2026-02-13T12:47:22","/conventions/dice-diversions-2026/schedule/32"
"Opening Ceremonies - Sponsored by The Op","144","Special Event","Ryan Gutowski, ShannonDeWitt","Kick off Dice + Diversions with The Op! Check out TACTA™, a clever and colorful card game of flipping and aligning shapes. Enjoy casual play, explore smart strategies, and take part in special giveaways throughout the event.","0","All Ages","60","30","0","Friday at  5:00 PM","2026-02-20T22:00:00","60","http://","Salon A, B","General Admission","2025-12-22T15:00:37","2026-02-14T12:52:41","/conventions/dice-diversions-2026/schedule/144"
"The Whimsy Engine","66","RPG","Itsgonnarayne, Mickeymicheal42","""The Whimsy Engine"" is a roleplaying game of wonder, wit, and weirdness, set in a magical Gilded Age where style is strength, charm is currency, and narrative drives reality. The rules are simple but the plot can be as complicated and in-depth as you desire. New TTRPG - will be teaching system.","0","Adult (18+)","6","3","0","Friday at  6:00 PM","2026-02-20T23:00:00","240","http://","Hall of Heroes","Green Meeple 6","2025-11-26T16:51:04","2026-02-11T19:43:25","/conventions/dice-diversions-2026/schedule/66"
"Knarr: Learn to play","294","Board Game","adelinezbrz","In Knarr, you are the leader of a band of Vikings that you send to new destinations. Manage the recruitment of your crew, and choose the best territories to explore. Depending on the destinations reached (for trading or influence) and the Vikings who accompany you, you can increase your reputation","0","Adult (18+)","4","1","0","Friday at  6:00 PM","2026-02-20T23:00:00","60","http://","Decatur/Marietta","Red Meeple 1","2026-02-10T15:13:56","2026-02-14T00:49:56","/conventions/dice-diversions-2026/schedule/294"
"PFS2 7-02: Shipyard Sabotage","98","RPG","Herron64710, Liam Fisher","A Pathfinder Society Scenario designed for 1st- through 4th-level characters. Tensions are high following the Battle of Hellknight Hill, and while Cheliax hasn't taken any direct action, they've encouraged privateers to attack Andoran shipping.","0","Teen (13+)","6","0","0","Friday at  6:00 PM","2026-02-20T23:00:00","300","https://store.paizo.com/pathfinder-society-scenario-7-02-shipyard-sabotage/","Hall of Heroes","Green Meeple 8","2025-12-08T03:51:32","2026-01-21T20:07:30","/conventions/dice-diversions-2026/schedule/98"
"Ark Nova- for Beginners","14","Board Game","sarrington","4 players race to build the best zoo possible!","0","Teen (13+)","4","4","0","Friday at  6:00 PM","2026-02-20T23:00:00","180","http://","Decatur/Marietta","Red Meeple 3","2025-11-20T03:01:57","2026-02-15T04:22:59","/conventions/dice-diversions-2026/schedule/14"
"Svalbard (Cypher System/Modern Horror)","48","RPG","PaleoGamer","An unexplained radiation event, followed by a cryptic radio message, has sent a response team to the far-northern Norwegian island of Svalbard. The response team is elite. The best of the best.

But... are they prepared for the horrors they face? Horrors they cannot escape, even in death?","0","Teen (13+)","6","4","0","Friday at  6:00 PM","2026-02-20T23:00:00","240","http://","Hall of Heroes","Green Meeple 11","2025-11-23T18:51:01","2026-01-21T20:08:05","/conventions/dice-diversions-2026/schedule/48"
"Dice + Diversions Insider Tour","253","Special Event","radiowing@gmail.com","New to Dice + Diversions? First time using Tabletop.Events? Or just want a quick lay of the land and a chance to meet one of the event organizers? We’ve got you covered.","0","All Ages","12","1","0","Friday at  6:00 PM","2026-02-20T23:00:00","30","http://","Hotel Lobby","General Admission","2026-01-14T02:26:34","2026-01-21T20:08:20","/conventions/dice-diversions-2026/schedule/253"
"Ultimate Werewolf","197","Social Deduction","","Werewolf is a social deduction game played in rounds with two phases: day and night. By day, players debate who is guilty; by night, special powers are used and the werewolves secretly choose a victim. Will you survive?","0","Teen (13+)","20","2","0","Friday at  6:00 PM","2026-02-20T23:00:00","60","https://boardgamegeek.com/boardgame/152241/ultimate-werewolf","Grand Ballroom - Hallway","Social Deduction Corner","2026-01-06T00:55:55","2026-02-14T20:13:16","/conventions/dice-diversions-2026/schedule/197"
"The Rattling Roar, A Wildsea One-Shot","265","RPG","Q","This is an introduction to the Wildsea, a solarpunk game of verdant strangeness. Ship and Character Pre-Gens provided for this Beginner Wildsea One-Shot.","0","Adult (18+)","6","4","0","Friday at  6:00 PM","2026-02-20T23:00:00","240","http://felixisaacs.itch.io/the-wildsea-free-basic-rules","Hall of Heroes","Green Meeple 2","2026-01-18T20:09:20","2026-01-26T02:45:43","/conventions/dice-diversions-2026/schedule/265"
"Koopia","225","Playtesting (Unreleased Game)","Keith_Koopia","Koopia is a handcrafted wooden dexterity game designed for quick play and lasting fun. Players flick discs into scoring pits using skill and control, making every round exciting and accessible for all ages and skill levels.","0","All Ages","4","1","0","Friday at  6:00 PM","2026-02-20T23:00:00","60","http://","Grand Ballroom - Hallway","Playtest Pavilion - Blue Meeple 3","2026-01-09T01:36:31","2026-02-10T20:29:57","/conventions/dice-diversions-2026/schedule/225"
"Mothership - The Haunting of Ypsilon-14","86","RPG","Ben Torell","Take the helm of the starship Tempest on a routine supply run to a remote asteroid Mining base, Ypsilon-14, where not all is as it seems.

Beginner friendly! All supplies/characters provided.","0","Adult (18+)","5","4","1","Friday at  6:00 PM","2026-02-20T23:00:00","240","https://www.tuesdayknightgames.com/pages/mothership-rpg","Hall of Heroes","Green Meeple 7","2025-12-01T15:02:15","2026-02-13T22:53:27","/conventions/dice-diversions-2026/schedule/86"
"Blood on the Clocktower","210","Social Deduction","","Blood on the Clocktower	Blood on the Clocktower is a social deduction game of secrets, lies, and logic. Players take on hidden roles as Good or Evil, using unique abilities, discussion, and deception to identify the Demon before time runs out—or ensure it survives.","0","Teen (13+)","12","7","0","Friday at  6:00 PM","2026-02-20T23:00:00","120","https://boardgamegeek.com/boardgame/240980/blood-on-the-clocktower","Albany Room (Social Deductions)","General Seating","2026-01-08T01:52:48","2026-01-21T20:09:02","/conventions/dice-diversions-2026/schedule/210"
"Barista or Bust","246","Playtesting (Unreleased Game)","adam0084","Compete to be the best barista! Place your wager on how many drinks you think you can serve and then work together with the other baristas to try and achieve your goal to gain valuable experience points XP and win.","0","Adult (18+)","5","0","0","Friday at  6:00 PM","2026-02-20T23:00:00","120","http://","Grand Ballroom - Hallway","Playtest Pavilion - Blue Meeple 1","2026-01-14T01:45:50","2026-01-21T20:09:05","/conventions/dice-diversions-2026/schedule/246"
"""Who The Devil Are You?"" a game by Monte Cook","94","RPG","Dspayr","In most RPGs, the GM provides the story, setting, and context to the players and the players create characters to fit that world. But what if we turned all that upside down? In this game, the process of making the characters also builds the world the adventure.","0","All Ages","8","2","0","Friday at  6:00 PM","2026-02-20T23:00:00","120","https://www.montecookgames.com/who-the-devil-are-you/","Hall of Heroes","Green Meeple 10","2025-12-06T17:05:56","2026-02-13T13:25:29","/conventions/dice-diversions-2026/schedule/94"
"Knarr - Learn to play","293","Board Game","adelinezbrz","In Knarr, you are the leader of a band of Vikings that you send to new destinations. Manage the recruitment of your crew, and choose the best territories to explore. Depending on the destinations reached (for trading or influence) and the Vikings who accompany you, you can increase your reputation","0","Adult (18+)","4","0","0","Friday at  7:00 PM","2026-02-21T00:00:00","60","http://","Decatur/Marietta","Red Meeple 1","2026-02-10T15:13:52","2026-02-10T15:19:42","/conventions/dice-diversions-2026/schedule/293"
"My Father’s Work","26","Board Game","Greg Forster","Gather forbidden occult knowledge and conduct horrifying experiments to carry on your father's macabre ""science"" for the benefit (?) of future generations! This app-driven Euro/Ameritrash hybrid is dripping with fun Gothic theme, but is also a well-designed, deeply satisfying worker-placement game.","0","Teen (13+)","3","3","2","Friday at  7:00 PM","2026-02-21T00:00:00","240","https://boardgamegeek.com/boardgame/328866/my-fathers-work","Decatur/Marietta","Red Meeple 5","2025-11-20T15:11:25","2026-01-21T20:07:29","/conventions/dice-diversions-2026/schedule/26"
"Squabble Squares: Tournament","254","Tournaments","Ben Moomaw","Quick demonstration and competition","0","All Ages","8","1","0","Friday at  7:00 PM","2026-02-21T00:00:00","60","http://squabblesquaresgame.com","Decatur/Marietta","Red Meeple 9","2026-01-14T02:32:06","2026-01-31T14:32:34","/conventions/dice-diversions-2026/schedule/254"
"Magical Athlete (Sponsored by CYMK Games)","177","Eat, Play, Win!","ShannonDeWitt","Step into a world where sports meet spellcasting! Magical Athlete is a delightful, fast-paced card game where magical competitors go head-to-head in enchanted athletic events. Play cards, trigger abilities, and outscore your opponents as you cheer your favorite athlete to victory.","23","All Ages","50","46","0","Friday at  7:00 PM","2026-02-21T00:00:00","90","https://diceanddiversions.com/eat-play-win/","Salon A, B","General Admission","2025-12-24T15:21:58","2026-02-14T03:14:50","/conventions/dice-diversions-2026/schedule/177"
"DC20 Tutorial: Job Hunting","132","RPG","_RM_","This game is intended for first-time or novice DC20 players. I will start the session with an overview of the rules, and then we will dive into the adventure.","0","Teen (13+)","6","4","0","Friday at  7:00 PM","2026-02-21T00:00:00","120","https://thedungeoncoach.com/pages/dc20","Hall of Heroes","Green Meeple 9","2025-12-15T18:25:17","2026-01-21T20:08:12","/conventions/dice-diversions-2026/schedule/132"
"Apiary: Learn to Play","135","Board Game","Aaron Butler","Apiary is a worker placement game by Stonemaier where you are in control of a hive of highly evolved space bees. Bees in space!!","0","Teen (13+)","4","4","0","Friday at  7:00 PM","2026-02-21T00:00:00","120","https://boardgamegeek.com/boardgame/400314/apiary","Decatur/Marietta","Red Meeple 2","2025-12-20T21:47:20","2026-02-14T04:20:34","/conventions/dice-diversions-2026/schedule/135"
"Learn to Play Orleans","21","Board Game","dianadreeben@att.net","During the medieval goings-on around Orléans, you must assemble a following of farmers, merchants, knights, monks, etc. to gain supremacy through trade, construction and science in medieval France.

In Orléans, you will recruit followers and put them to work to make use of their abilities. Farmers a","0","Teen (13+)","4","4","1","Friday at  7:00 PM","2026-02-21T00:00:00","120","https://boardgamegeek.com/boardgame/164928/orleans","Decatur/Marietta","Red Meeple 4","2025-11-20T03:03:17","2026-01-21T20:08:25","/conventions/dice-diversions-2026/schedule/21"
"Ultimate Werewolf","198","Social Deduction","","Werewolf is a social deduction game played in rounds with two phases: day and night. By day, players debate who is guilty; by night, special powers are used and the werewolves secretly choose a victim. Will you survive?","0","Teen (13+)","20","0","0","Friday at  7:00 PM","2026-02-21T00:00:00","60","https://boardgamegeek.com/boardgame/152241/ultimate-werewolf","Grand Ballroom - Hallway","Social Deduction Corner","2026-01-06T00:57:32","2026-02-14T20:13:23","/conventions/dice-diversions-2026/schedule/198"
"The_Party_Line: Learn to Play","165","Playtesting (Unreleased Game)","Brad Wilkins ","The Party Line is a social deduction game where you play as farm animals voting on fictional issues affecting your farm. Your goal is to stay loyal by matching your votes to the Farmer's vote. But beware there are multiple factions with their own unique win conditions.","0","Adult (18+)","6","1","0","Friday at  7:00 PM","2026-02-21T00:00:00","180","https://www.thepartylinegame.com/","Grand Ballroom - Hallway","Playtest Pavilion - Blue Meeple 3","2025-12-22T23:36:08","2026-02-09T02:04:58","/conventions/dice-diversions-2026/schedule/165"
"GMing 201 - Elevating Your GM Skills to the Next Level!","263","Special Event","IanBard","A fun & educational session to level-up your GMing! Topics: Performing voices for NPCs, Speeding up areas that often drag, and other tips to enhance your games!

Led by Ian O'Donnell, veteran GM, game author & speaker at DragonCon, Momocon, SFGE. Ian is also a Dialect Coach & Voice Actor himself!","0","All Ages","50","3","0","Friday at  7:30 PM","2026-02-21T00:30:00","60","http://","Diversions Room - Salon C","Salon C","2026-01-17T22:40:36","2026-02-12T18:44:44","/conventions/dice-diversions-2026/schedule/263"
"Emberheart","289","Board Game","The Gaming Lady","Rescue and train dragons, rally heroes, and make a stand against the dragon poachers","0","Teen (13+)","4","1","0","Friday at  8:00 PM","2026-02-21T01:00:00","120","https://boardgamegeek.com/boardgame/452817/emberheart","Decatur/Marietta","Red Meeple 7","2026-02-10T15:13:32","2026-02-14T12:45:09","/conventions/dice-diversions-2026/schedule/289"
"Aperture","249","Playtesting (Unreleased Game)","adam0084","Aperture is a quick board game where 2-4 players compete to shoot the best roll of film! Each new photo card you take determines how your previous shot is framed and gets scored. This creates a dynamic and ever-evolving composition. Navigate the board, make clever plays, and fulfill hidden objective","0","Adult (18+)","4","2","0","Friday at  8:00 PM","2026-02-21T01:00:00","120","http://","Grand Ballroom - Hallway","Playtest Pavilion - Blue Meeple 1","2026-01-14T01:55:18","2026-01-21T20:07:07","/conventions/dice-diversions-2026/schedule/249"
"Secrets Of Lords and Ladies (D&D 5th level, Edition 2024)","142","RPG","Galbatorix","In the old world of London, something old springs in the night. In the era of Victoria London, you are sent as detectives to find the secret and the one responsible. As something odd starts happening to the Lords and Ladies of London. Some go missing so murder in the night. Its on you to find out.","0","Adult (18+)","6","2","0","Friday at  8:00 PM","2026-02-21T01:00:00","240","http://","Hall of Heroes","Green Meeple 1","2025-12-21T22:05:00","2026-02-09T02:25:10","/conventions/dice-diversions-2026/schedule/142"
"Knarr: Learn to Play","9","Board Game","adelinezbrz","In Knarr, you are the leader of a band of Vikings that you send to new destinations. Manage the recruitment of your crew, and choose the best territories to explore.","0","Adult (18+)","4","4","0","Friday at  8:00 PM","2026-02-21T01:00:00","60","https://boardgamegeek.com/boardgame/379629/knarr","Decatur/Marietta","Red Meeple 1","2025-11-20T02:54:07","2026-01-21T20:07:29","/conventions/dice-diversions-2026/schedule/9"
"Blood on the Clocktower","211","Social Deduction","","Blood on the Clocktower	Blood on the Clocktower is a social deduction game of secrets, lies, and logic. Players take on hidden roles as Good or Evil, using unique abilities, discussion, and deception to identify the Demon before time runs out—or ensure it survives.","0","Teen (13+)","12","3","0","Friday at  8:00 PM","2026-02-21T01:00:00","120","https://boardgamegeek.com/boardgame/240980/blood-on-the-clocktower","Albany Room (Social Deductions)","General Seating","2026-01-08T01:56:56","2026-02-09T02:19:42","/conventions/dice-diversions-2026/schedule/211"
"Hot Streak","244","Board Game","Ryan Gutowski","Learn and play Hot Streak, the hilarious mascot racing game from CMYK Games. Erin and Ryan from One Board Family will get you and your friends setup and bidding on these wacky racers.","0","Preteen (8+)","8","6","0","Friday at  8:00 PM","2026-02-21T01:00:00","60","http://","Decatur/Marietta","Red Meeple 9","2026-01-12T17:45:18","2026-02-09T03:15:52","/conventions/dice-diversions-2026/schedule/244"
"Townsfolk Tussle: Learn & Play!","163","Board Game","min27241","Come join me at the table to play a highly flavorful cooperative, dice-chucking, boss battler: Townsfolk Tussle! Oozing in 1930's cartoon style (think of Cuphead and Steamboat Willy), the game is lightweight in complexity.","0","Teen (13+)","4","0","0","Friday at  8:00 PM","2026-02-21T01:00:00","240","https://boardgamegeek.com/boardgame/312859/townsfolk-tussle","Decatur/Marietta","Red Meeple 6","2025-12-22T23:18:25","2026-01-21T20:08:32","/conventions/dice-diversions-2026/schedule/163"
